{
    "scraped_data": {
        "summary": "Il documento descrive una notifica di infrazione avvenuta il 17 aprile 2025 alle ore 20:30. L'infrazione riguarda un veicolo Ducati Multistrada, immatricolato in Svizzera, con targa speciale. La violazione è avvenuta presso via della Repubblica 20 e via dei Fori Imperiali al civico 10, violando il codice penale, articolo 8 comma 6, per parcheggio su strisce pedonali. Sono stati decurtati 10 punti e applicata una sanzione accessoria. Il veicolo è un ciclomotore bianco. La stampa deve essere effettuata tramite Wi-Fi in portoghese, senza includere la comunicazione.",
        "report": {
            "verbale_preavviso": null,
            "data_violazione": "diciassette aprile duemilaventicinque",
            "ora_violazione": "venti e trenta",
            "Strada_1": "via della repubblica",
            "Civico_1": "dieci",
            "lista_veicoli": [
                {
                    "tipologia": "ciclomotori",
                    "nazione": "svizzera",
                    "targa": "i miei centoventitre capelli",
                    "tipologia_targa": "speciale",
                    "marca_modello": "ducati molti strada",
                    "colore": "bianco"
                }
            ],
            "contestazione_immediata": null,
            "motivo_mancata_contestazione": null,
            "violazioni": [
                {
                    "codice": "penale",
                    "articolo": "otto",
                    "comma": "sei",
                    "sanzione_accessoria": "applico una sanzione accessoria"
                }
            ],
            "punti": "dieci",
            "tipo_stampa": "vuoi fa",
            "lingua_stampa": "portoghese",
            "stampa_anche_comunicazione": "non stampare anche la comunicazione"
        },
        "missing_required_infos": []
    },
    "original_transcribed_sentence": "il diciassette aprile duemilaventicinque alle ore venti e trenta sto mettendo una notifica di infrazione per il veicolo ducati molti strada due ciclomotori immatricolati in svizzera con targa i miei centoventitre capelli di tipo speciale l'infrazione si e verificata presso via della repubblica venti via dei fori imperiali al civico dieci violando il codice penale in particolare l'articolo otto comma sei riguardante il parcheggio su strisce pedonali devo decurtare dieci punti applico una sanzione accessoria in base alle circostanze il ciclo motore di colore bianco con numero di telaio uno quattro due quattro nove otto nove nove sei e massa duemilanovecento sessantasette chili stampa me lo con il vuoi fa in portoghese non stampare anche la comunicazione",
    "original_sentence": "Il 17/04/2025, alle ore 20:30, sto emettendo una notifica di infrazione per il veicolo Ducati Multistrada V2, ciclomotore immatricolato in svizzera con targa IJ123KL di tipo speciale. L'infrazione si è verificata presso via della Repubblica, 20via dei Fori Imperiali, al civico 10, violando il codice penale, in particolare l'articolo 8, comma 6 riguardante il parcheggio su strisce pedonali. Devo decurtare 10 punti. Applico una sanzione accessoria in base alle circostanze. Il ciclomotore è di colore bianco, con numero di telaio 142498996 e massa 2967 kg. Stampamelo con il wifi in portoghese, non stampare anche la comunicazione. "
}