{
    "scraped_data": {
        "summary": "Il documento notifica un preavviso di violazione per un veicolo immatricolato in Spagna. La violazione è avvenuta il 8 aprile 2025 alle 8:35 in viale della Vittoria, civico 9, per parcheggio davanti a passo carabine. La violazione riguarda l'articolo 44, comma 42 del codice stradale, con una decurtazione di 1 punto. Si richiede la stampa del preavviso in lingua tedesca tramite Wi-Fi, senza stampare anche la comunicazione.",
        "report": {
            "verbale_preavviso": "preavviso",
            "data_violazione": "otto aprile duemilaventicinque",
            "ora_violazione": "otto e trentacinque",
            "Strada_1": "viale della vittoria",
            "Civico_1": "nove",
            "lista_veicoli": [
                {
                    "tipologia": "autovettura",
                    "nazione": "spagna",
                    "targa": "icsi ypsilon trecentoventi uno sa",
                    "tipologia_targa": "ufficiale",
                    "marca_modello": "nucleo",
                    "colore": null
                }
            ],
            "contestazione_immediata": null,
            "motivo_mancata_contestazione": null,
            "violazioni": [
                {
                    "codice": "stradale",
                    "articolo": "quarantaquattro",
                    "comma": "quarantadue",
                    "sanzione_accessoria": null
                }
            ],
            "punti": "uno",
            "tipo_stampa": "vuoi fai",
            "lingua_stampa": "tedesco",
            "stampa_anche_comunicazione": "non stampare anche la comunicazione"
        },
        "missing_required_infos": []
    },
    "original_transcribed_sentence": "si notifica la presenza di un preavviso di violazione per il veicolo autovettura marcare nucleo targa icsi ypsilon trecentoventi uno sa di tipo ufficiale immatricolati in spagna la violazione è avvenuta hai lotto aprile duemilaventicinque alle otto e trentacinque viale della vittoria al numero civico nove ed è relativa a parcheggio davanti a passo carabine invase all'articolo quarantaquattro comma quarantadue del codice stradale per tale violazione sono previsti uno punti di decurtazione si richiede la stampa di tale preavviso in lingua tedesco tramite vuoi fai non stampare anche la comunicazione",
    "original_sentence": "Si notifica la presenza di un preavviso di violazione per il veicolo autovettura, marca Renault Clio, targa XY321ZA di tipo ufficiale, immatricolato in spagna. La violazione è avvenuta il 08/04/2025 alle ore 08:35 in viale della Vittoria, al numero civico 9, ed è relativa a parcheggio davanti a passo carrabile, in base all'articolo 44, comma 42 del codice stradale.Per tale violazione sono previsti 1 punti di decurtazione. Si richiede la stampa di tale preavviso in lingua tedesco tramite wifi, non stampare anche la comunicazione."
}