{
    "scraped_data": {
        "summary": "Il documento descrive un avviso di violazione per un veicolo registrato in Svizzera, accaduto il 29 aprile 2025 alle 23:18. Il veicolo, una macchina operatrice targata ufficiale, era parcheggiato in doppia fila in via della Musica al civico 18. La violazione è in base all'articolo 51 comma 49 del codice stradale e comporta una decurtazione di 10 punti. La stampa dell'avviso è prevista via Hawaii e in spagnolo, includendo anche la comunicazione.",
        "report": {
            "verbale_preavviso": "preavviso",
            "data_violazione": "ventinove aprile duemilaventicinque",
            "ora_violazione": "ventitré diciotto",
            "Strada_1": "via della musica",
            "Civico_1": "diciotto",
            "lista_veicoli": [
                {
                    "tipologia": "macchina operatrice",
                    "nazione": "svizzera",
                    "targa": "quattrocentocinquanta sei occhi",
                    "tipologia_targa": "ufficiale",
                    "marca_modello": "amai ypsilon seta e ferre sette",
                    "colore": null
                }
            ],
            "contestazione_immediata": null,
            "motivo_mancata_contestazione": null,
            "violazioni": [
                {
                    "codice": "stradale",
                    "articolo": "cinquantuno",
                    "comma": "quarantanove",
                    "sanzione_accessoria": null
                }
            ],
            "punti": "dieci",
            "tipo_stampa": "hawaii",
            "lingua_stampa": "spagnolo",
            "stampa_anche_comunicazione": "stampa anche la comunicazione"
        },
        "missing_required_infos": []
    },
    "original_transcribed_sentence": "e metto un avviso di violazione quindi si tratta di un preavviso per il veicolo amai ypsilon seta e ferre sette macchina operatrice targato quattrocentocinquanta sei occhi con targa ufficiale registrato in svizzera per un fatto accaduto il ventinove aprile duemilaventicinque alle ventitré diciotto il veicolo si trovava in via della musica al civico diciotto dove è stato riscontrato parcheggia in doppia fila in base all'articolo cinquantuno comma quarantanove del codice stradale questa infrazione comporta una decurtazione di dieci punti genera alla stampa dell'avviso via hawaii fa in spagnolo stampa anche la comunicazione",
    "original_sentence": "Emetto un avviso di violazione, quindi si tratta di un preavviso, per il veicolo Yamaha YZF-R7, macchina operatrice, targato MN456OP con targa ufficiale, registrato in svizzera,  per un fatto accaduto il 29/04/2025 alle 23:18. Il veicolo si trovava in via della Musica, al civico 18, dove è stato riscontrato parcheggio in doppia fila, in base all'articolo 51, comma 49, del codice stradale. Questa infrazione comporta una decurtazione di 10 punti.  Genera la stampa dell'avviso via wifi in spagnolo, stampa anche la comunicazione."
}