{
    "scraped_data": {
        "summary": "Il documento descrive un preavviso notificato il cinque maggio duemilaventicinque alle ore cinque e cinquantasei per un rimorchio con targa ufficiale immatricolato in Slovenia. L'infrazione è stata rilevata in via venti settembre al civico cinque, violando il codice penale articolo trentacinque comma trentatré. Non è stato possibile contestare immediatamente per l'assenza del trasgressore. Sono da decurtare nove punti. Il veicolo è un BMW serie uno di colore marrone. La stampa del preavviso è richiesta tramite wifi in portoghese, con inclusione della comunicazione.",
        "report": {
            "verbale_preavviso": "preavviso",
            "data_violazione": "cinque maggio duemilaventicinque",
            "ora_violazione": "cinque i cinquantasei",
            "Strada_1": "via venti settembre",
            "Civico_1": "cinque",
            "lista_veicoli": [
                {
                    "tipologia": "rimorchio",
                    "nazione": "slovenia",
                    "targa": "effe quattrocentocinquanta sei giacca",
                    "tipologia_targa": "ufficiale",
                    "marca_modello": "bmw serie uno",
                    "colore": "marrone"
                }
            ],
            "contestazione_immediata": null,
            "motivo_mancata_contestazione": "assenza del trasgressori",
            "violazioni": [
                {
                    "codice": "penale",
                    "articolo": "trentacinque",
                    "comma": "trentatré",
                    "sanzione_accessoria": null
                }
            ],
            "punti": "nove, before: decurtare, after: punti",
            "tipo_stampa": "wifi",
            "lingua_stampa": "portoghese",
            "stampa_anche_comunicazione": "stampa anche la comunicazione"
        },
        "missing_required_infos": []
    },
    "original_transcribed_sentence": "in data cinque maggio duemilaventicinque alle ore cinque i cinquantasei è stato notificato un preavviso per un rimorchio targato effe quattrocentocinquanta sei giacca con targa ufficiale immatricolati slovenia l'infrazione e stata rilevata in via venti settembre al civico cinque con violazioni del codice penale articolo trentacinque con ma trentatré in particolare sia riscontrato un parcheggio davanti a passo carabine non è stato possibile contestare per l'assenza del trasgressori da decurtare ci sono nove punti il veicolo è un bmw serie uno di colore marrone con numero di telaio nove nove tre sei cinque sette due otto e massa duemila ottocentoquarantasei chili necessita la stampa del preavviso tramite wifi in portoghese stampa anche la comunicazione",
    "original_sentence": "In data 05/05/2025, alle ore 05:56, è stato notificato un preavviso per un rimorchio targato EF456GH con targa ufficiale, immatricolato in slovenia. L'infrazione è stata rilevata in via XX Settembre, al civico 5, con violazione del codice penale, articolo 35, comma 33, in particolare si è riscontrato un parcheggio davanti a passo carrabile Non è stato possibile contestare per l'assenza del trasgressore. Da decurtare ci sono 9 punti. Il veicolo è un BMW Serie 1 di colore marrone, con numero di telaio 993657208 e massa 2846 kg. Necessito la stampa del preavviso tramite wifi, in portoghese, stampa anche la comunicazione. "
}