{
    "scraped_data": {
        "summary": "Il documento descrive un preavviso di violazione per un veicolo autovettura con targa \"jeff sei centocinquantaquattro giacca\", proveniente dalla Germania e di marca \"mas da due\". La violazione riguarda il parcheggio davanti a un passo carabine, avvenuta il 20 aprile 2025 alle ore 14:25 in via della storia, numero civico 6. L'infrazione è classificata sotto l'articolo 38, comma 36 del codice civile. La contestazione immediata non è stata possibile a causa dell'assenza del trasgressore. La sanzione comporta la perdita di 8 punti. Si richiede la stampa in lingua tedesca tramite Bluetooth, includendo anche la comunicazione.",
        "report": {
            "verbale_preavviso": "preavviso",
            "data_violazione": "venti aprile duemilaventicinque",
            "ora_violazione": "quattordici e venticinque",
            "Strada_1": "via della storia",
            "Civico_1": "sei",
            "lista_veicoli": [
                {
                    "tipologia": "autovettura",
                    "nazione": "germania",
                    "targa": "jeff sei centocinquantaquattro giacca",
                    "tipologia_targa": "prova",
                    "marca_modello": "mas da due",
                    "colore": null
                }
            ],
            "contestazione_immediata": null,
            "motivo_mancata_contestazione": "assenza del trasgressori",
            "violazioni": [
                {
                    "codice": "civile",
                    "articolo": "trentotto",
                    "comma": "trentasei",
                    "sanzione_accessoria": null
                }
            ],
            "punti": "otto, before: perdita, after: punti",
            "tipo_stampa": "blu",
            "lingua_stampa": "tedesco",
            "stampa_anche_comunicazione": "stampa anche la comunicazione"
        },
        "missing_required_infos": []
    },
    "original_transcribed_sentence": "si notifica un preavviso relativo al veicolo autovettura targato jeff sei centocinquantaquattro giacca di tipo prova proveniente da germania marca mas da due la violazione ovvero parcheggio davanti a passo carabine sia e verificata in data venti aprile duemilaventicinque alle ore quattordici e venticinque in via della storia al numero sei l'infrazione rientra nell'articolo trentotto con ma trentasei del codice civile non è stato possibile contestare immediatamente a causa dell'assenza del trasgressori la sanzione prevede la perdita di otto punti si richiede la stampa in lingua tedesco tramite blu stampa anche la comunicazione",
    "original_sentence": "Si notifica un preavviso relativo al veicolo autovettura targato EF654GH di tipo prova proveniente da germania, marca Mazda 2. La violazione, ovvero parcheggio davanti a passo carrabile, si è verificata in data 20/04/2025 alle ore 14:25 in via della Storia, al numero 6. L'infrazione rientra nell'articolo 38, comma 36 del codice civile. Non è stato possibile contestare immediatamente a causa dell'assenza del trasgressore. La sanzione prevede la perdita di 8 punti. Si richiede la stampa in lingua tedesco, tramite bluetooth, stampa anche la comunicazione."
}