{
    "scraped_data": {
        "summary": "Il documento descrive una violazione avvenuta il tre maggio duemilaventicinque alle ore ventiquattro e quarantatré. Un verbale è stato elevato al veicolo Hope il Corsa rimorchio con targa Episodio sette centottantanove giacca, immatricolato in Portogallo, per violazione dell'articolo trenta comma ventotto del codice civile, ovvero parcheggio in zona a rimozione. La violazione è stata rilevata in via Giuseppe Mazzini al civico ventiquattro e la contestazione è stata immediata, effettuata dall'agente Francesco Rizzo. La violazione comporta la decurtazione di due punti. La stampa necessaria è in lingua francese via Bluetooth, senza stampare anche la comunicazione.",
        "report": {
            "verbale_preavviso": "verbale",
            "data_violazione": "tre maggio duemilaventicinque",
            "ora_violazione": "ventiquattro hai quarantatré",
            "Strada_1": "via giuseppe mazzini",
            "Civico_1": "ventiquattro",
            "lista_veicoli": [
                {
                    "tipologia": "rimorchio",
                    "nazione": "portogallo",
                    "targa": "episodio sette centottantanove giacca",
                    "tipologia_targa": "speciale",
                    "marca_modello": "hope il corsa",
                    "colore": null
                }
            ],
            "contestazione_immediata": "contestazione e stata immediata",
            "motivo_mancata_contestazione": null,
            "violazioni": [
                {
                    "codice": "civile",
                    "articolo": "trenta",
                    "comma": "ventotto",
                    "sanzione_accessoria": null
                }
            ],
            "punti": "due, before: derivano, after: di",
            "tipo_stampa": "blu tutte",
            "lingua_stampa": "francese",
            "stampa_anche_comunicazione": "non stampare anche la comunicazione"
        },
        "missing_required_infos": []
    },
    "original_transcribed_sentence": "in data tre maggio duemilaventicinque alle ore ventiquattro hai quarantatré si eleva verbale al veicolo hope il corsa rimorchio con targa episodio sette centottantanove giacca di tipo speciale immatricolati in portogallo per violazione dell'articolo trenta comma ventotto del codice civile ovvero parcheggio in zona a rimozione rilevata in via giuseppe mazzini al civico ventiquattro la contestazione e stata immediata effettuata dalla gente francesco rizzo dalla violazione derivano due punti di decurtazione stampa necessaria in lingua francese via blu tutte non stampare anche la comunicazione",
    "original_sentence": "In data 03/05/2025, alle ore 00:43, si eleva verbale al veicolo Opel Corsa, rimorchio con targa EP789GH di tipo speciale, immatricolato in portogallo, per violazione dell'articolo 30, comma 28 del codice civile, ovvero parcheggio in zona rimozione, rilevata in via Giuseppe Mazzini, al civico 24. La contestazione è stata immediata, effettuata dall'agente Francesco Rizzo. Dalla violazione derivano 2 punti di decurtazione. Stampa necessaria in lingua francese via bluetooth, non stampare anche la comunicazione. "
}