{
    "scraped_data": {
        "summary": "Il documento descrive una violazione avvenuta il quattro maggio duemilaventicinque alle otto e quarantotto. Un verbale è stato elevato al veicolo Mazda Chips con targa ufficiale italiana per parcheggio su strisce pedonali. La violazione è stata rilevata in via della Concordia al civico tredici. Non è stata possibile la contestazione immediata per assenza del trasgressore. La violazione comporta la decurtazione di cinque punti. La stampa del verbale è richiesta in lingua inglese e include anche la comunicazione.",
        "report": {
            "verbale_preavviso": "verbali",
            "data_violazione": "quattro omaggio duemilaventicinque",
            "ora_violazione": "otto e quarantotto",
            "Strada_1": "via della concordia",
            "Civico_1": "tredici",
            "lista_veicoli": [
                {
                    "tipologia": "ciclomotori",
                    "nazione": "italia",
                    "targa": "ho un novecentottanta sette doppia bux",
                    "tipologia_targa": "ufficiale",
                    "marca_modello": "mazda chips",
                    "colore": null
                }
            ],
            "contestazione_immediata": null,
            "motivo_mancata_contestazione": "assenza del trasgressori",
            "violazioni": [
                {
                    "codice": "penale",
                    "articolo": "sei",
                    "comma": "uno",
                    "sanzione_accessoria": null
                }
            ],
            "punti": "cinque",
            "tipo_stampa": "via hawaii",
            "lingua_stampa": "inglese",
            "stampa_anche_comunicazione": "fai stampa anche la comunicazione"
        },
        "missing_required_infos": []
    },
    "original_transcribed_sentence": "in data quattro omaggio duemilaventicinque alle otto e quarantotto si eleva verbali al veicolo mazda chips tre ciclomotori con targa ho un novecentottanta sette doppia bux di tipo ufficiale immatricolati in italia per violazione dell'articolo sei comma uno a uno a dodici del codice penale ovvero parcheggio su strisce pedonali rilevata inviarle della concordia al civico tredici non è stato possibile effettuare la contestazione immediata per assenza del trasgressori dalla violazione derivano cinque punti di decurtazione stampa necessaria in lingua inglese via hawaii fai stampa anche la comunicazione",
    "original_sentence": "In data 04/05/2025, alle ore 08:48, si eleva verbale al veicolo Mazda CX-3, ciclomotore con targa UV987WX di tipo ufficiale, immatricolato in italia, per violazione dell'articolo 6, comma 1a(1-12) del codice penale, ovvero parcheggio su strisce pedonali, rilevata in viale della Concordia, al civico 13. Non è stato possibile effettuare la contestazione immediata, per assenza del trasgressore. Dalla violazione derivano 5 punti di decurtazione. Stampa necessaria in lingua inglese via wifi, stampa anche la comunicazione. "
}