{
    "scraped_data": {
        "summary": "Il documento descrive un verbale redatto il dieci aprile duemilaventicinque alle ore quattro e diciotto per una violazione riscontrata su un veicolo Subaru proveniente dall'Italia. La violazione riguarda il parcheggio in zona a rimozione, in violazione dell'articolo quattordici comma uno del codice penale. L'agente Chiara Romano ha proceduto con contestazione immediata e si prevede la decurtazione di cinque punti dalla patente. La stampa è richiesta in portoghese via Hawaii, senza includere la comunicazione.",
        "report": {
            "verbale_preavviso": "verbale",
            "data_violazione": "dieci aprile duemilaventicinque",
            "ora_violazione": "quattro e diciotto",
            "Strada_1": "corso della storia",
            "Civico_1": "ventidue",
            "lista_veicoli": [
                {
                    "tipologia": "autovettura",
                    "nazione": "italia",
                    "targa": "icsi ypsilon trecentoventi uno",
                    "tipologia_targa": "speciale",
                    "marca_modello": "subaru impresa",
                    "colore": null
                }
            ],
            "contestazione_immediata": "contestazione immediata",
            "motivo_mancata_contestazione": null,
            "violazioni": [
                {
                    "codice": "penale",
                    "articolo": "quattordici",
                    "comma": "uno",
                    "sanzione_accessoria": null
                }
            ],
            "punti": "cinque",
            "tipo_stampa": "hawaii",
            "lingua_stampa": "portoghese",
            "stampa_anche_comunicazione": "non stampare anche la comunicazione"
        },
        "missing_required_infos": []
    },
    "original_transcribed_sentence": "verbale redatto in data dieci aprile duemilaventicinque alle ore quattro e diciotto per la violazione riscontrata al veicolo autovettura marca subaru impresa targato icsi ypsilon trecentoventi uno tipo speciale proveniente da italia in particolare in corso della storia civico ventidue è stato accertato parcheggio in zona a rimozione in violazione dell'articolo quattordici con ma uno del codice penale l'agente chiara romano a proceduto con contestazione immediata si prevede la decurtazione di cinque punti dalla patente richiedo la stampa in portoghese via hawaii fai non stampare anche la comunicazione",
    "original_sentence": "Verbale redatto in data 10/04/2025 alle ore 04:18 per la violazione riscontrata al veicolo autovettura, marca Subaru Impreza, targato XY321ZA (tipo speciale) proveniente da italia. In particolare, in corso della Storia, civico 22, è stato accertato parcheggio in zona rimozione, in violazione dell'articolo 14, comma 1 del codice penale. L'agente Chiara Romano ha proceduto con contestazione immediata. Si prevede la decurtazione di 5 punti dalla patente. Richiedo la stampa in portoghese via wifi, non stampare anche la comunicazione."
}