{
    "scraped_data": {
        "summary": "Il documento descrive un preavviso per una violazione di parcheggio in doppia fila avvenuta il 24 aprile 2025 alle 20:45 in viale della Scienza, numero 14. Il veicolo coinvolto è una macchina operatrice targata ICSI Ypsilon 3201, di tipo copertura, proveniente dalla Slovenia, marca Ducati Multistrada. La violazione rientra nell'articolo 3, comma 1 del codice civile. Non è stato possibile contestare immediatamente a causa dell'assenza del trasgressore. La sanzione prevede la perdita di sette punti. Si richiede la stampa in lingua olandese tramite Bluetooth, includendo anche la comunicazione.",
        "report": {
            "verbale_preavviso": "preavviso",
            "data_violazione": "ventiquattro aprile duemilaventicinque",
            "ora_violazione": "venti e quarantacinque",
            "Strada_1": "viale della scienza",
            "Civico_1": "quattordici",
            "lista_veicoli": [
                {
                    "tipologia": "macchina operatrice",
                    "nazione": "slovenia",
                    "targa": "icsi ypsilon trecentoventi uno",
                    "tipologia_targa": null,
                    "marca_modello": "ducati multi strada due",
                    "colore": null
                }
            ],
            "contestazione_immediata": null,
            "motivo_mancata_contestazione": "assenza del trasgressori",
            "violazioni": [
                {
                    "codice": "civile",
                    "articolo": "tre",
                    "comma": "uno",
                    "sanzione_accessoria": null
                }
            ],
            "punti": "sette",
            "tipo_stampa": "blu tutte",
            "lingua_stampa": "olandese",
            "stampa_anche_comunicazione": "stampa anche la comunicazione"
        },
        "missing_required_infos": []
    },
    "original_transcribed_sentence": "si notifica un preavviso relativo al vicolo macchina operatrice targato icsi ypsilon trecentoventi uno di tipo copertura proveniente da slovenia marca ducati multi strada due la violazione ovvero parcheggio in doppia fila sia verificata in data ventiquattro aprile duemilaventicinque alle ore venti e quarantacinque in viale della scienza al numero quattordici l'infrazione rientra nell'articolo tre con ma uno del codice civile non è stato possibile contestare immediatamente a causa dell'assenza del trasgressori la sanzioni prevede la perdita di sette punti si richiede la stampa in lingua olandese tramite blu tutte stampa anche la comunicazione",
    "original_sentence": "Si notifica un preavviso relativo al veicolo macchina operatrice targato XY321ZA di tipo copertura proveniente da slovenia, marca Ducati Multistrada V2. La violazione, ovvero parcheggio in doppia fila, si è verificata in data 24/04/2025 alle ore 20:45 in viale della Scienza, al numero 14. L'infrazione rientra nell'articolo 3, comma 1 del codice civile. Non è stato possibile contestare immediatamente a causa dell'assenza del trasgressore. La sanzione prevede la perdita di 7 punti. Si richiede la stampa in lingua olandese, tramite bluetooth, stampa anche la comunicazione. "
}