{
    "scraped_data": {
        "summary": "Il documento descrive un verbale redatto il tre maggio duemilaventicinque alle ore una e quarantasei per una violazione riscontrata. Il veicolo coinvolto è un motoveicolo BMW Jeff novecento serre con targa ufficiale ABE 450 6 CD, proveniente dal Belgio. La violazione è avvenuta in via della Pace, civico due, per transito in zona accesso vietato, violando l'articolo sette, comma quindici del codice civile. La contestazione non è stata immediata a causa dell'assenza del conducente. Si prevede la decurtazione di sei punti dalla patente. La stampa è richiesta in spagnolo via Hawaii e non include la comunicazione.",
        "report": {
            "verbale_preavviso": "verbale",
            "data_violazione": "tre maggio duemilaventicinque",
            "ora_violazione": "una e quarantasei",
            "Strada_1": "via della pace",
            "Civico_1": "due",
            "lista_veicoli": [
                {
                    "tipologia": "motoveicolo",
                    "nazione": "belgio",
                    "targa": "abe quattrocentocinquanta sei ci",
                    "tipologia_targa": "ufficiale",
                    "marca_modello": "bmw jeff novecento serre",
                    "colore": null
                }
            ],
            "contestazione_immediata": null,
            "motivo_mancata_contestazione": "assenza del conducente",
            "violazioni": [
                {
                    "codice": "civile",
                    "articolo": "sette",
                    "comma": "quindici",
                    "sanzione_accessoria": null
                }
            ],
            "punti": "sei",
            "tipo_stampa": "hawaii fai",
            "lingua_stampa": "spagnolo",
            "stampa_anche_comunicazione": "non stampare anche la comunicazione"
        },
        "missing_required_infos": []
    },
    "original_transcribed_sentence": "verbale redatto in data a tre maggio duemilaventicinque alle ore una e quarantasei per la violazione riscontrata al veicolo molto veicolo marca bmw jeff novecento serre targato abe quattrocentocinquanta sei ci di tipo ufficiale proveniente da belgio in particolare in via della pace civico due è stato accertato transito in zona accesso vietato in violazione dell'articolo sette con ma quindici del codice civile data all'assenza del conducente la contestazione non è stata immediata si prevede la decurtazione di sei punti dalla patente richiedo la stampa in spagnolo via hawaii fai non stampare anche la comunicazione",
    "original_sentence": "Verbale redatto in data 03/05/2025 alle ore 01:46 per la violazione riscontrata al veicolo motoveicolo, marca BMW F 900 XR, targato AB456CD (tipo ufficiale) proveniente da belgio. In particolare, in via della Pace, civico 2, è stato accertato transito in zona accesso vietato, in violazione dell'articolo 7, comma 15 del codice civile. Data l'assenza del conducente, la contestazione non è stata immediata.Si prevede la decurtazione di 6 punti dalla patente. Richiedo la stampa in spagnolo via wifi, non stampare anche la comunicazione."
}