{
    "scraped_data": {
        "summary": "Il documento notifica un preavviso di violazione emesso il ventotto aprile duemilaventicinque alle ore diciotto per un veicolo Subaru con targa francese. L'infrazione è avvenuta in via della Libertà, numero ventuno, per transito in zona accesso vietato, secondo l'articolo ventidue del codice penale. Non è stato possibile identificare il conducente sul posto, quindi la notifica è inviata al proprietario del veicolo. Sono previsti due punti di decurtazione. La notifica deve essere stampata tramite Bluetooth in lingua francese, senza includere la comunicazione.",
        "report": {
            "verbale_preavviso": "preavviso",
            "data_violazione": "ventotto aprile duemilaventicinque",
            "ora_violazione": "diciotto",
            "Strada_1": "via della libertà",
            "Civico_1": "ventuno",
            "lista_veicoli": [
                {
                    "tipologia": "autovettura",
                    "nazione": "francia",
                    "targa": "i ehi centoventitre cappelle",
                    "tipologia_targa": "prova",
                    "marca_modello": "subaru",
                    "colore": null
                }
            ],
            "contestazione_immediata": null,
            "motivo_mancata_contestazione": "non essendo stato possibile identificare il conducente sul posto",
            "violazioni": [
                {
                    "codice": "penale",
                    "articolo": "ventidue",
                    "comma": "commoventi",
                    "sanzione_accessoria": null
                }
            ],
            "punti": "due, before: previsti, after: di",
            "tipo_stampa": "blu tutte",
            "lingua_stampa": "francese",
            "stampa_anche_comunicazione": "non stampare anche la comunicazione"
        },
        "missing_required_infos": []
    },
    "original_transcribed_sentence": "si notifica che in data ventotto aprile duemilaventicinque alle ore diciotto eventi è stato emesso un preavviso di violazione per il veicolo autovettura di marca subaru in presa con targa i ehi centoventitre cappelle tipo prova registrato in francia l'infrazione è avvenuta in via della libertà al numero ventuno e consiste in transito in zona accesso vietato come previsto dall'articolo ventidue commoventi del codice penale non essendo stato possibile identificare il conducente sul posto la notifica viene inviata al proprietario del veicolo sono previsti due punti di decurtazione si prega di stampare la presente notifica tramite blu tutte in lingua francese non stampare anche la comunicazione",
    "original_sentence": "Si notifica che in data 28/04/2025, alle ore 18:20, è stato emesso un preavviso di violazione per il veicolo autovettura di marca Subaru Impreza, con targa IJ123KL (tipo prova), registrato in francia. L'infrazione è avvenuta in via della Libertà, al numero 21, e consiste in transito in zona accesso vietato, come previsto dall'articolo 22, comma 20 del codice penale. Non essendo stato possibile identificare il conducente sul posto, la notifica viene inviata al proprietario del veicolo. Sono previsti 2 punti di decurtazione. Si prega di stampare la presente notifica tramite bluetooth, in lingua francese, non stampare anche la comunicazione. "
}