{
    "scraped_data": {
        "summary": "Il documento informa che è in corso la stesura di un preavviso di violazione per un veicolo con targa \"jeff sette centottantanove giacca\", di tipo \"prova\", marca \"su chi swift\", proveniente dalla Francia. L'infrazione riguarda il parcheggio davanti a passo carabine, verificatasi il 30 aprile 2025 alle ore 6:43 in via della Repubblica 20 e via dei Fori Imperiali al numero 10. La violazione è dell'articolo 24, comma 22 del codice civile, con una decurtazione di 10 punti. Si richiede la stampa in lingua olandese, modalità \"hawaii\", e di stampare anche la comunicazione.",
        "report": {
            "verbale_preavviso": "preavviso",
            "data_violazione": "trenta aprile duemilaventicinque",
            "ora_violazione": "sei e quarantatré",
            "Strada_1": "via della repubblica",
            "Civico_1": "venti",
            "lista_veicoli": [
                {
                    "tipologia": "prova",
                    "nazione": "francia",
                    "targa": "jeff sette centottantanove giacca",
                    "tipologia_targa": null,
                    "marca_modello": "su chi swift",
                    "colore": null
                }
            ],
            "contestazione_immediata": null,
            "motivo_mancata_contestazione": null,
            "violazioni": [
                {
                    "codice": "civile",
                    "articolo": "ventiquattro",
                    "comma": "ventidue",
                    "sanzione_accessoria": null
                }
            ],
            "punti": "dieci",
            "tipo_stampa": "hawaii",
            "lingua_stampa": "olandese",
            "stampa_anche_comunicazione": "stampa anche la comunicazione"
        },
        "missing_required_infos": []
    },
    "original_transcribed_sentence": "si avvisa che è in corso la stesura di un preavviso di violazione per il veicolo molto veicolo con targa è jeff sette centottantanove giacca di tipo prova marca su chi swift proveniente da francia l'infrazione nello specifico parcheggio davanti a passo carabine sia e verificata in data trenta aprile duemilaventicinque alle ore sei e quarantatré in via della repubblica venti via dei fori imperiali al numero dieci articolo ventiquattro con ma ventidue del codice civile si comunica che dalla violazione conseguirà una decurtazione di dieci punti si richiede la stampa in lingua olandese modalità hawaii fai stampa anche la comunicazione",
    "original_sentence": "Si avvisa che è in corso la stesura di un preavviso di violazione per il veicolo motoveicolo con targa EF789GH di tipo prova, marca Suzuki Swift, proveniente da francia. L'infrazione, nello specifico parcheggio davanti a passo carrabile, si è verificata in data 30/04/2025 alle ore 06:43 in via della Repubblica, 20via dei Fori Imperiali, al numero 10 (articolo 24, comma 22 del codice civile). Si comunica che dalla violazione conseguirà una decurtazione di 10 punti.Si richiede la stampa in lingua olandese, modalità wifi, stampa anche la comunicazione."
}