{
    "scraped_data": {
        "summary": "Il documento descrive un verbale redatto il tredici aprile duemilaventicinque alle ore ventiquattro e tre per una violazione riscontrata su un veicolo macchina agricola marca Peugeout 208, targato IM 456 CF, tipo ufficiale, proveniente dal Belgio. La violazione è avvenuta in corso della Giustizia, civico 23, per transito in zona accesso vietato, violando l'articolo 21, comma 19 del codice civile. La contestazione non è stata immediata a causa dell'assenza del conducente. Si prevede la decurtazione di cinque punti dalla patente. La stampa è richiesta in spagnolo via Hawaii, con inclusione della comunicazione.",
        "report": {
            "verbale_preavviso": "verbale",
            "data_violazione": "tredici aprile duemilaventicinque",
            "ora_violazione": "ventiquattro e tre",
            "Strada_1": "corso della giustizia",
            "Civico_1": "ventitré",
            "lista_veicoli": [
                {
                    "tipologia": "macchina agricola",
                    "nazione": "belgio",
                    "targa": "i miei quattrocentocinquanta sei capelli",
                    "tipologia_targa": "ufficiale",
                    "marca_modello": "peggio duecentotto",
                    "colore": null
                }
            ],
            "contestazione_immediata": null,
            "motivo_mancata_contestazione": "assenza del conducente",
            "violazioni": [
                {
                    "codice": "civile",
                    "articolo": "ventuno",
                    "comma": "diciannove",
                    "sanzione_accessoria": null
                }
            ],
            "punti": "cinque",
            "tipo_stampa": "hawaii",
            "lingua_stampa": "spagnolo",
            "stampa_anche_comunicazione": "fai stampa anche la comunicazione"
        },
        "missing_required_infos": []
    },
    "original_transcribed_sentence": "verbale redatto in data tredici aprile duemilaventicinque alle ore ventiquattro e tre per la violazione riscontrata al veicolo macchina agricola marca peggio duecentotto targato i miei quattrocentocinquanta sei capelli tipo ufficiale proveniente da belgio in particolare in corso della giustizia civico ventitré è stato accertato transito in zona accesso vietato in violazione dell'articolo ventuno come diciannove del codice civile data l'assenza del conducente la contestazioni non è stata immediata si prevede la decurtazioni di cinque punti dalla patente richiedo la stampa in spagnolo via hawaii fai stampa anche la comunicazione",
    "original_sentence": "Verbale redatto in data 13/04/2025 alle ore 00:03 per la violazione riscontrata al veicolo macchina agricola, marca Peugeot 208, targato IJ456KL (tipo ufficiale) proveniente da belgio. In particolare, in corso della Giustizia, civico 23, è stato accertato transito in zona accesso vietato, in violazione dell'articolo 21, comma 19 del codice civile. Data l'assenza del conducente, la contestazione non è stata immediata. Si prevede la decurtazione di 5 punti dalla patente. Richiedo la stampa in spagnolo via wifi, stampa anche la comunicazione. "
}