{
    "scraped_data": {
        "summary": "Il documento descrive una violazione notificata il sette aprile duemilaventicinque alle ore nove e ventiquattro. È stato emesso un preavviso per un rimorchio con targa ufficiale immatricolato in Portogallo. L'infrazione è avvenuta in corso della storia al civico ventidue, violando il codice stradale, articolo tredici, comma undici, per parcheggio in doppia fila. Non è stato possibile contestare immediatamente per l'assenza del trasgressore. Sono da decurtare sei punti. Il veicolo è un Mercedes Classe A bianco. La stampa del preavviso è richiesta tramite Bluetooth in tedesco, con inclusione della comunicazione.",
        "report": {
            "verbale_preavviso": "preavviso",
            "data_violazione": "sette aprile duemilaventicinque",
            "ora_violazione": "nuove ventiquattro",
            "Strada_1": "corso della storia",
            "Civico_1": "ventidue, before: al, after: con",
            "lista_veicoli": [
                {
                    "tipologia": "rimorchio",
                    "nazione": "portogallo",
                    "targa": "jeff trecentoventi uno giacca",
                    "tipologia_targa": "ufficiale",
                    "marca_modello": "mercedes classe a",
                    "colore": "bianco"
                }
            ],
            "contestazione_immediata": null,
            "motivo_mancata_contestazione": "assenza del trasgressore",
            "violazioni": [
                {
                    "codice": "stradale",
                    "articolo": "tredici, before: articolo, after: comma",
                    "comma": "undici, before: comma, after: in",
                    "sanzione_accessoria": null
                }
            ],
            "punti": "sei, before: decurtare, after: punti",
            "tipo_stampa": "blu",
            "lingua_stampa": "tedesco",
            "stampa_anche_comunicazione": "stampa anche la comunicazione"
        },
        "missing_required_infos": []
    },
    "original_transcribed_sentence": "in data sette aprile duemilaventicinque alle ore nuove ventiquattro è stato notificato un preavviso per un rimorchio targato jeff trecentoventi uno giacca con targa ufficiale immatricolati in portogallo l'infrazione è stata rilevate in corso della storia al civico ventidue con violazione del codice stradale articolo tredici comma undici in particolare si riscontrato un parcheggio in doppia fila non è stato possibile contestare per l'assenza del trasgressori da decurtare ci sono sei punti il veicolo è un mercedes classe a di colore bianco con numero di telaio sei centosedici milioni e cinquecentottanta tremiladuecento due massa duemilacinquecento dieci chilogrammi necessita la stampa del preavviso tramite blu in tedesco stampa anche la comunicazione",
    "original_sentence": "In data 07/04/2025, alle ore 09:24, è stato notificato un preavviso per un rimorchio targato EF321GH con targa ufficiale, immatricolato in portogallo. L'infrazione è stata rilevata in corso della Storia, al civico 22, con violazione del codice stradale, articolo 13, comma 11, in particolare si è riscontrato un parcheggio in doppia fila Non è stato possibile contestare per l'assenza del trasgressore. Da decurtare ci sono 6 punti. Il veicolo è un Mercedes Classe A di colore bianco, con numero di telaio 616583202 e massa 2510 kg.Necessito la stampa del preavviso tramite bluetooth, in tedesco, stampa anche la comunicazione."
}