{
    "scraped_data": {
        "summary": "Il documento notifica un preavviso di violazione per un veicolo immatricolato in Grecia. La violazione è avvenuta il 30 aprile 2025 alle 8:50 in corso Buenos Aires, civico 98, per parcheggio davanti a passo carabine. La violazione riguarda l'articolo 51, comma 49 del codice stradale, con una decurtazione di 8 punti. Si richiede la stampa del preavviso in lingua italiana tramite Wi-Fi, senza stampare anche la comunicazione.",
        "report": {
            "verbale_preavviso": "preavviso",
            "data_violazione": "trenta aprile duemilaventicinque",
            "ora_violazione": "otto e cinquanta",
            "Strada_1": "corso buenos aires",
            "Civico_1": "novantotto",
            "lista_veicoli": [
                {
                    "tipologia": "ciclomotori",
                    "nazione": "grecia",
                    "targa": "quattrocentocinquanta sei ci di di",
                    "tipologia_targa": "speciale",
                    "marca_modello": "manca mai ypsilon jeff terre sette",
                    "colore": null
                }
            ],
            "contestazione_immediata": null,
            "motivo_mancata_contestazione": null,
            "violazioni": [
                {
                    "codice": "stradale",
                    "articolo": "cinquantuno",
                    "comma": "quarantanove",
                    "sanzione_accessoria": null
                }
            ],
            "punti": "otto",
            "tipo_stampa": "guai fai",
            "lingua_stampa": "italiano",
            "stampa_anche_comunicazione": "non stampare anche la comunicazione"
        },
        "missing_required_infos": []
    },
    "original_transcribed_sentence": "si notifica la presenza di un preavviso di violazione per il veicolo ciclomotori manca mai ypsilon jeff terre sette targa quattrocentocinquanta sei ci di di tipo speciale immatricolati in grecia la violazione è avvenuta il trenta aprile duemilaventicinque alle otto e cinquanta in corso buenos aires al numero civico novantotto ed è relativa parcheggio davanti a passo carabine in base al all'articolo cinquantuno comma quarantanove del codice stradale per tali violazione sono previsti otto punti di decurtazione si richiede la stampa di tale preavviso in lingua italiano tramite guai fai non stampare anche la comunicazione",
    "original_sentence": "Si notifica la presenza di un preavviso di violazione per il veicolo ciclomotore, marca Yamaha YZF-R7, targa AB456CD di tipo speciale, immatricolato in grecia. La violazione è avvenuta il 30/04/2025 alle ore 08:50 in corso Buenos Aires, al numero civico 98, ed è relativa a parcheggio davanti a passo carrabile, in base all'articolo 51, comma 49 del codice stradale. Per tale violazione sono previsti 8 punti di decurtazione. Si richiede la stampa di tale preavviso in lingua italiano tramite wifi, non stampare anche la comunicazione. "
}