{
    "scraped_data": {
        "summary": "Il documento descrive la stesura di un verbale per un veicolo rimorchio proveniente dall'Austria, targato \"ubi trecentoventi uno doppia ex\" di tipo prova. L'infrazione è stata rilevata il 30 aprile 2025 alle 10:35 in via Etna, civico 45, davanti a Pasto Carabine. La violazione riguarda l'articolo 5, comma 3 del codice penale. L'agente Giulia Costa ha effettuato la contestazione immediata, comportando la perdita di cinque punti. Si richiede la stampa del verbale in tedesco tramite Wi-Fi, includendo anche la comunicazione.",
        "report": {
            "verbale_preavviso": "verbale",
            "data_violazione": "trenta aprile duemilaventicinque",
            "ora_violazione": "dieci e trentacinque",
            "Strada_1": "via etna",
            "Civico_1": "quarantacinque",
            "lista_veicoli": [
                {
                    "tipologia": "rimorchio",
                    "nazione": "austria",
                    "targa": "ubi trecentoventi uno doppia ex",
                    "tipologia_targa": "prova",
                    "marca_modello": null,
                    "colore": null
                }
            ],
            "contestazione_immediata": "contestazione immediata",
            "motivo_mancata_contestazione": null,
            "violazioni": [
                {
                    "codice": "penale",
                    "articolo": "cinque",
                    "comma": "tre",
                    "sanzione_accessoria": null
                }
            ],
            "punti": "cinque",
            "tipo_stampa": "vuoi fai",
            "lingua_stampa": "tedesco",
            "stampa_anche_comunicazione": "stampa anche la comunicazione"
        },
        "missing_required_infos": []
    },
    "original_transcribed_sentence": "procedo con la stesura di un verbale per il veicolo rimorchio marcare nucleo targato ubi trecentoventi uno doppia ex di tipo prova proveniente da austria l'infrazione e stata rilevata il trenta aprile duemilaventicinque alle ore dieci e trentacinque il veicolo si trovava in via etna al civico quarantacinque in parcheggio davanti a pasto carabine violando l'articolo cinque con tre del codice penale l'agente giulia costa provveduto alla contestazione immediata dell'infrazione la violazione comporta la perdita di cinque punti richiedo la stampa del verbale in tedesco tramite vuoi fai stampa anche la comunicazione",
    "original_sentence": "Procedo con la stesura di un verbale per il veicolo rimorchio, marca Renault Clio, targato UV321WX (di tipo prova), proveniente da austria.  L'infrazione è stata rilevata il 30/04/2025 alle ore 10:35. Il veicolo si trovava in via Etnea, al civico 45, in parcheggio davanti a passo carrabile, violando l'articolo 5, comma 3, del codice penale. L'agente Giulia Costa ha provveduto alla contestazione immediata dell'infrazione. La violazione comporta la perdita di 5 punti.  Richiedo la stampa del verbale in tedesco tramite wifi, stampa anche la comunicazione."
}