{
    "scraped_data": {
        "summary": "Il documento descrive una violazione avvenuta il 17 aprile 2025 alle ore 19:13. Un verbale è stato elevato al veicolo \"Pennelli Leoncino 500\" con targa \"I EHI 789\", immatricolato in Spagna, per parcheggio in divieto di sosta. La violazione è stata rilevata in viale della stazione, civico 4. La contestazione è stata immediata, effettuata dall'agente Sara Bellini. La violazione comporta la decurtazione di 8 punti. La stampa del verbale è richiesta in lingua olandese via WiFi, senza stampare anche la comunicazione.",
        "report": {
            "verbale_preavviso": "verbale",
            "data_violazione": "diciassette aprile duemilaventicinque",
            "ora_violazione": "diciannove i tredici",
            "Strada_1": "viale della stazione",
            "Civico_1": "quattro",
            "lista_veicoli": [
                {
                    "tipologia": "ciclomotori",
                    "nazione": "spagna",
                    "targa": "i ehi settecento ottantanove cappello",
                    "tipologia_targa": "prova",
                    "marca_modello": "pennelli leoncino cinquecento",
                    "colore": null
                }
            ],
            "contestazione_immediata": "contestazione stata immediata",
            "motivo_mancata_contestazione": null,
            "violazioni": [
                {
                    "codice": "civile",
                    "articolo": "quarantaquattro",
                    "comma": "quarantadue",
                    "sanzione_accessoria": null
                }
            ],
            "punti": "otto, before: derivano, after: decurtazione",
            "tipo_stampa": "wifi",
            "lingua_stampa": "olandese",
            "stampa_anche_comunicazione": "non stampare anche la comunicazione"
        },
        "missing_required_infos": []
    },
    "original_transcribed_sentence": "in data diciassette aprile duemilaventicinque alle ore diciannove i tredici si eleva verbale al veicolo pennelli leoncino cinquecento ciclomotori con targa i ehi settecento ottantanove cappello di tipo prova immatricolati in spagna per violazione dell'articolo quarantaquattro come quarantadue del codice civile ovvero parcheggio in divieto di sosta rilevata in viale della stazione al civico quattro la contestazione stata immediata effettuata dalla gente sara bellini dalla violazione derivano otto punti di decurtazione stampa necessaria in lingua olandese via wifi non stampare anche la comunicazione",
    "original_sentence": "In data 17/04/2025, alle ore 19:13, si eleva verbale al veicolo Benelli Leoncino 500, ciclomotore con targa IJ789KL di tipo prova, immatricolato in spagna, per violazione dell'articolo 44, comma 42 del codice civile, ovvero parcheggio in divieto di sosta, rilevata in viale della Stazione, al civico 4. La contestazione è stata immediata, effettuata dall'agente Sara Bellini. Dalla violazione derivano 8 punti di decurtazione. Stampa necessaria in lingua olandese via wifi, non stampare anche la comunicazione. "
}