{
    "scraped_data": {
        "summary": "Il documento descrive una notifica di infrazione avvenuta il 23 aprile 2025 alle ore 19:19 per un veicolo immatricolato in Belgio con targa ufficiale. L'infrazione si è verificata in via Giuseppe Mazzini, civico 24, violando il codice stradale, articolo 50, comma 48, riguardante il parcheggio su strisce pedonali. Sono stati decurtati 8 punti e applicata una sanzione accessoria. Il veicolo è un'autovettura rossa con numero di telaio specificato e massa di 3093 kg. La stampa è richiesta via WiFi in spagnolo, includendo anche la comunicazione.",
        "report": {
            "verbale_preavviso": null,
            "data_violazione": "ventitré aprile duemilaventicinque",
            "ora_violazione": "diciannove diciannove",
            "Strada_1": "via giuseppe mazzini",
            "Civico_1": "ventiquattro",
            "lista_veicoli": [
                {
                    "tipologia": "autovettura",
                    "nazione": "belgio",
                    "targa": "ho sette centottantanove doppia ex",
                    "tipologia_targa": "ufficiale",
                    "marca_modello": null,
                    "colore": "rosso"
                }
            ],
            "contestazione_immediata": null,
            "motivo_mancata_contestazione": null,
            "violazioni": [
                {
                    "codice": "stradale",
                    "articolo": "cinquanta",
                    "comma": "quarantotto",
                    "sanzione_accessoria": "applico una sanzione accessoria"
                }
            ],
            "punti": "otto",
            "tipo_stampa": "vuoi fa",
            "lingua_stampa": "spagnolo",
            "stampa_anche_comunicazione": "stampa anche la comunicazione"
        },
        "missing_required_infos": []
    },
    "original_transcribed_sentence": "il ventitré aprile duemilaventicinque alle ore diciannove diciannove sto mettendo una notifica di infrazione per il veicolo chi pianto autovettura immatricolati in belgio con targa ho sette centottantanove doppia ex di tipo ufficiale l'infrazione si e verificata presso via giuseppe mazzini al civico ventiquattro violando il codice stradale in particolare l'articolo cinquanta con ma quarantotto riguardante il parcheggio su strisce pedonali devo decurtare otto punti applico una sanzione accessoria in base alle circostanze il autovettura e di colore rosso con numero di telaio quattrocentoquaranta cinque milioni e ventiseimila seicento e massa tremila e novantatré chilogrammi stampa me lo con il vuoi fa in spagnolo stampa anche la comunicazione",
    "original_sentence": "Il 23/04/2025, alle ore 19:19, sto emettendo una notifica di infrazione per il veicolo Kia Picanto, autovettura immatricolato in belgio con targa UV789WX di tipo ufficiale. L'infrazione si è verificata presso via Giuseppe Mazzini, al civico 24, violando il codice stradale, in particolare l'articolo 50, comma 48 riguardante il parcheggio su strisce pedonali.Devo decurtare 8 punti. Applico una sanzione accessoria in base alle circostanze. Il autovettura è di colore rosso, con numero di telaio 445026600 e massa 3093 kg.Stampamelo con il wifi in spagnolo, stampa anche la comunicazione."
}