{
    "scraped_data": {
        "summary": "Il documento descrive un verbale in corso per un veicolo rimorchio di marca Chapas con targa ICSI Ypsilon 987 ZZA, tipo ufficiale, proveniente dalla Germania. L'infrazione è avvenuta il 25 aprile 2025 alle ore 2:49 in via della Pace, numero civico 2, per parcheggio davanti a passo carabine, violando l'articolo 7, comma 5 del codice civile. La decurtazione prevista è di sette punti. La contestazione è immediata e viene eseguita dall'agente Anna Bianchi. La stampa è richiesta tramite Wi-Fi in olandese, senza stampare anche la comunicazione.",
        "report": {
            "verbale_preavviso": "verbale",
            "data_violazione": "venticinque aprile duemilaventicinque",
            "ora_violazione": "due quarantanove",
            "Strada_1": "via della pace",
            "Civico_1": "due",
            "lista_veicoli": [
                {
                    "tipologia": "rimorchio",
                    "nazione": "germania",
                    "targa": "icsi ypsilon novecentottanta sette zza",
                    "tipologia_targa": "ufficiale",
                    "marca_modello": "chapas",
                    "colore": null
                }
            ],
            "contestazione_immediata": "contestazione immediata",
            "motivo_mancata_contestazione": null,
            "violazioni": [
                {
                    "codice": "civile",
                    "articolo": "sette",
                    "comma": "cinque",
                    "sanzione_accessoria": null
                }
            ],
            "punti": "sette",
            "tipo_stampa": "vuoi fa",
            "lingua_stampa": "olandese",
            "stampa_anche_comunicazione": "non stampare anche la comunicazione"
        },
        "missing_required_infos": []
    },
    "original_transcribed_sentence": "redazione verbale in corso per il veicolo rimorchio di marca chapas a in in già seicentocinquanta con targa icsi ypsilon novecentottanta sette zza tipo ufficiale proveniente da germania fatto avvenuto il venticinque aprile duemilaventicinque alle ore due quarantanove posizione via della pace numero civico due infrazione parcheggio davanti a passo carabine in violazione dell'articolo sette con ma cinque del codice civile decurtazione prevista sette punti si applica contestazione immediata da parte della gente anna bianchi stampa necessaria tramite vuoi fa in olandese non stampare anche la comunicazione",
    "original_sentence": "Redazione verbale in corso per il veicolo rimorchio di marca Kawasaki Ninja 650, con targa XY987ZA (tipo ufficiale), proveniente da germania.  Fatto avvenuto il 25/04/2025 alle ore 02:49. Posizione: via della Pace, numero civico 2. Infrazione: parcheggio davanti a passo carrabile, in violazione dell'articolo 7, comma 5, del codice civile. Decurtazione prevista: 7 punti. Si applica contestazione immediata da parte dell'agente Anna Bianchi. Stampa necessaria tramite wifi in olandese, non stampare anche la comunicazione."
}