{
    "scraped_data": {
        "summary": "Il documento descrive un verbale redatto l'otto aprile 2025 alle ore 7:57 per una violazione riscontrata su un veicolo rimorchio marca \"chi ha pianto\" targato \"sa 450 6 cupi\" tipo speciale proveniente dall'Olanda. La violazione è avvenuta in via della cultura, civico 9, per parcheggio in doppia fila, violando l'articolo 121, comma 9 del codice civile. La contestazione non è stata immediata a causa dell'assenza del conducente. Si prevede la decurtazione di sei punti dalla patente. La stampa è richiesta in spagnolo via Hawaii fai, senza stampare anche la comunicazione.",
        "report": {
            "verbale_preavviso": "verbale",
            "data_violazione": "otto aprile duemilaventicinque",
            "ora_violazione": "sette cinquantasette",
            "Strada_1": "via della cultura",
            "Civico_1": "nove",
            "lista_veicoli": [
                {
                    "tipologia": "rimorchio",
                    "nazione": "olanda",
                    "targa": "sa quattrocentocinquanta sei cupi",
                    "tipologia_targa": "speciale",
                    "marca_modello": "chi ha pianto",
                    "colore": null
                }
            ],
            "contestazione_immediata": null,
            "motivo_mancata_contestazione": "assenza del conducente",
            "violazioni": [
                {
                    "codice": "civile",
                    "articolo": "centoventi uno",
                    "comma": "nove",
                    "sanzione_accessoria": null
                }
            ],
            "punti": "sei",
            "tipo_stampa": "hawaii fai",
            "lingua_stampa": "spagnolo",
            "stampa_anche_comunicazione": "non stampare anche la comunicazione"
        },
        "missing_required_infos": []
    },
    "original_transcribed_sentence": "verbale redatto in data otto aprile duemilaventicinque alle ore sette cinquantasette per la violazione riscontrata al veicolo rimorchio marca chi ha pianto targato sa quattrocentocinquanta sei cupi tipo speciale proveniente da olanda in particolare in via della cultura civico nove è stato accertato parcheggia in doppia fila in violazione dell'articolo centoventi uno con ma nove del codice civile data all'assenza del conducente la contestazione non è stata immediata si prevede la decurtazione di sei punti dalla patente richiedo la stampa in spagnolo via hawaii fai non stampare anche la comunicazione",
    "original_sentence": "Verbale redatto in data 08/04/2025 alle ore 07:57 per la violazione riscontrata al veicolo rimorchio, marca Kia Picanto, targato ZA456QP (tipo speciale) proveniente da olanda. In particolare, in via della Cultura, civico 9, è stato accertato parcheggio in doppia fila, in violazione dell'articolo 121, comma 9 del codice civile. Data l'assenza del conducente, la contestazione non è stata immediata.Si prevede la decurtazione di 6 punti dalla patente. Richiedo la stampa in spagnolo via wifi, non stampare anche la comunicazione."
}