{
    "scraped_data": {
        "summary": "Il documento descrive un'infrazione accertata il 13 aprile 2015 alle 13:34 in via della Speranza, civico 18. Il veicolo coinvolto è un motoveicolo con targa ufficiale immatricolato in Slovenia. La violazione riguarda il codice penale, articolo 158, comma 2, per parcheggio in divieto di sosta. Sono previsti nove punti da decurtare. Non è stata possibile una contestazione immediata per l'assenza del trasgressore. La stampa del verbale avviene tramite Bluetooth in italiano, senza includere la comunicazione.",
        "report": {
            "verbale_preavviso": "verbale",
            "data_violazione": "tredici aprile duemilaventicinque",
            "ora_violazione": "tredici trentaquattro",
            "Strada_1": "via della speranza",
            "Civico_1": "diciotto",
            "lista_veicoli": [
                {
                    "tipologia": "motoveicoli",
                    "nazione": "slovenia",
                    "targa": "vuoi trecentoventi uno doppio wings",
                    "tipologia_targa": "ufficiale",
                    "marca_modello": null,
                    "colore": null
                }
            ],
            "contestazione_immediata": null,
            "motivo_mancata_contestazione": "assenza del trasgressori",
            "violazioni": [
                {
                    "codice": "penale",
                    "articolo": "centocinquantotto",
                    "comma": "due",
                    "sanzione_accessoria": null
                }
            ],
            "punti": "nove",
            "tipo_stampa": "blu tutte",
            "lingua_stampa": "italiano",
            "stampa_anche_comunicazione": "non stampare anche la comunicazione"
        },
        "missing_required_infos": []
    },
    "original_transcribed_sentence": "alle tredici trentaquattro del tredici aprile duemilaventicinque storie dicendo un verbale per il veicolo motoveicoli targato vuoi trecentoventi uno doppio wings con targa ufficiale immatricolati slovenia l'infrazione è stata accertata in via della speranza al civico diciotto con violazione del codice penale articolo centocinquantotto comma due per parcheggio in divieto di sosta sono previsti nove punti da decurtare non è stata possibile una contestazione immediata per l'assenza del trasgressori non posso applicare alcuna sanzione accessoria stampa tramite blu tutte in italiano non stampare anche la comunicazione",
    "original_sentence": "Alle 13:34 del 13/04/2025, sto redigendo un verbale per il veicolo motoveicolo targato UV321WX con targa ufficiale, immatricolato in sloveniaL'infrazione è stata accertata in via della Speranza, al civico 18, con violazione del codice penale, articolo 158,comma 2 per parcheggio in divieto di sosta Sono previsti 9 punti da decurtare. Non è stata possibile una contestazione immediata per l'assenza del trasgressore. Non posso applicare alcuna sanzione accessoria. Stampa tramite bluetooth, in italiano, non stampare anche la comunicazione. "
}