{
    "scraped_data": {
        "summary": "Il documento notifica un preavviso di violazione emesso il sette maggio duemilaventicinque alle ore sette cinquantotto per un veicolo rimorchio di marca Fox Vaga in Polo con targa ufficiale registrato in Slovenia. L'infrazione è avvenuta in via della Giustizia al numero sedici, consistente nel parcheggio su strisce pedonali, violando l'articolo trentaquattro comma trentadue del codice stradale. Non essendo stato possibile identificare il conducente sul posto, la notifica è inviata al proprietario del veicolo. Sono previsti quattro punti di decurtazione. Si richiede la stampa della notifica tramite Bluetooth in lingua tedesca, senza stampare anche la comunicazione.",
        "report": {
            "verbale_preavviso": "preavviso",
            "data_violazione": "sette maggio duemilaventicinque",
            "ora_violazione": "sette cinquantotto",
            "Strada_1": "via della giustizia",
            "Civico_1": "sedici",
            "lista_veicoli": [
                {
                    "tipologia": "rimorchio",
                    "nazione": "slovenia",
                    "targa": "un vi centoventitre doppia ex",
                    "tipologia_targa": "ufficiale",
                    "marca_modello": "fox vaga in polo",
                    "colore": null
                }
            ],
            "contestazione_immediata": null,
            "motivo_mancata_contestazione": "non essendo stato possibile identificare il conducente sul posto",
            "violazioni": [
                {
                    "codice": "stradale",
                    "articolo": "trentaquattro",
                    "comma": "trentadue",
                    "sanzione_accessoria": null
                }
            ],
            "punti": "quattro, before: previsti, after: punti",
            "tipo_stampa": "blu",
            "lingua_stampa": "tedesco",
            "stampa_anche_comunicazione": "non stampare anche la comunicazione"
        },
        "missing_required_infos": []
    },
    "original_transcribed_sentence": "si notifica che in data sette maggio duemilaventicinque alle ore sette cinquantotto è stato emesso un preavviso di violazione per il veicolo rimorchio di marca fox vaga in polo con targa un vi centoventitre doppia ex tipo ufficiale registrato in slovenia l'infrazione avvenuta in via della giustizia al numero sedici e consiste in parcheggio su strisce pedonali come previsto dall'articolo trentaquattro comma trentadue del codice stradale non essendo stato possibile identificare il conducente sul posto la notifica viene inviata al proprietario del veicolo sono previsti quattro punti di decurtazione si prega di stampare la presente notifica tramite blu in lingua tedesco non stampare anche la comunicazione",
    "original_sentence": "Si notifica che in data 07/05/2025, alle ore 07:58, è stato emesso un preavviso di violazione per il veicolo rimorchio di marca Volkswagen Polo, con targa UV123WX (tipo ufficiale), registrato in slovenia. L'infrazione è avvenuta in via della Giustizia, al numero 16, e consiste in parcheggio su strisce pedonali, come previsto dall'articolo 34, comma 32 del codice stradale. Non essendo stato possibile identificare il conducente sul posto, la notifica viene inviata al proprietario del veicolo. Sono previsti 4 punti di decurtazione.  Si prega di stampare la presente notifica tramite bluetooth, in lingua tedesco, non stampare anche la comunicazione."
}