{
    "scraped_data": {
        "summary": "Il documento descrive la stesura di un verbale per un'infrazione stradale. Il veicolo coinvolto è un rimorchio marca Ducati Multi Strada VI, targato ICSI Ypsilon 987 SA, di tipo ufficiale, proveniente dal Portogallo. L'infrazione è stata rilevata il 7 aprile 2025 alle ore 3:30 in viale della Vittoria, civico 9, davanti a Pasto Carabine. L'articolo violato è il 29, comma 27 del codice stradale. L'agente Elena Fontana ha provveduto alla contestazione immediata, comportando la perdita di 10 punti. Si richiede la stampa del verbale in tedesco tramite Bluetooth, includendo anche la comunicazione.",
        "report": {
            "verbale_preavviso": "verbale",
            "data_violazione": "sette aprile duemilaventicinque",
            "ora_violazione": "tre e mezzo",
            "Strada_1": "viale della vittoria",
            "Civico_1": "nove",
            "lista_veicoli": [
                {
                    "tipologia": "rimorchio",
                    "nazione": "portogallo",
                    "targa": "icsi ypsilon novecentottanta sette sa",
                    "tipologia_targa": "ufficiale",
                    "marca_modello": "ducati multi strada vi due",
                    "colore": null
                }
            ],
            "contestazione_immediata": "contestazione immediata",
            "motivo_mancata_contestazione": null,
            "violazioni": [
                {
                    "codice": "stradale",
                    "articolo": "ventinove",
                    "comma": "ventisette",
                    "sanzione_accessoria": null
                }
            ],
            "punti": "dieci, before: perdita, after: punti",
            "tipo_stampa": "blu tutta",
            "lingua_stampa": "tedesco",
            "stampa_anche_comunicazione": "stampa anche la comunicazione"
        },
        "missing_required_infos": []
    },
    "original_transcribed_sentence": "procedo con la stesura di un verbale per il veicolo rimorchio marca ducati multi strada vi due targato icsi ypsilon novecentottanta sette sa di tipo ufficiale proveniente da portogallo l'infrazione e stata rilevata il sette aprile duemilaventicinque alle ore tre e mezzo il veicolo si trovava in viale della vittoria al civico nove in parcheggio davanti a pasto carabine violando l'articolo ventinove con ma ventisette del codice stradale l'agente elena fontana provveduto alla contestazione immediata dell'infrazione la violazione comporta la perdita di dieci punti richiedo la stampa del verbale in tedesco tramite blu tutta stampa anche la comunicazione",
    "original_sentence": "Procedo con la stesura di un verbale per il veicolo rimorchio, marca Ducati Multistrada V2, targato XY987ZA (di tipo ufficiale), proveniente da portogallo.  L'infrazione è stata rilevata il 07/04/2025 alle ore 03:30. Il veicolo si trovava in viale della Vittoria, al civico 9, in parcheggio davanti a passo carrabile, violando l'articolo 29, comma 27, del codice stradale. L'agente Elena Fontana ha provveduto alla contestazione immediata dell'infrazione. La violazione comporta la perdita di 10 punti.  Richiedo la stampa del verbale in tedesco tramite bluetooth, stampa anche la comunicazione."
}