{
    "scraped_data": {
        "summary": "Il documento descrive la stesura di un verbale per un'infrazione stradale. Il veicolo coinvolto è una macchina operatrice marca \"è vero l'espace\" con targa \"icsi ypsilon novecentottanta sette gettati\", di tipo ufficiale e proveniente dalla Croazia. L'infrazione è stata rilevata il 22 aprile 2025 alle ore 13:24. Il veicolo si trovava in via della Repubblica 20 e via dei Fori Imperiali al civico 10, parcheggiato in doppia fila, violando l'articolo 21 comma 19 del codice civile. L'agente Mario Rossi ha provveduto alla contestazione immediata. La violazione comporta la perdita di sette punti. Si richiede la stampa del verbale in spagnolo tramite Bluetooth, includendo anche la comunicazione.",
        "report": {
            "verbale_preavviso": "verbale",
            "data_violazione": "ventidue aprile duemilaventicinque",
            "ora_violazione": "tredici e ventiquattro",
            "Strada_1": "via della repubblica",
            "Civico_1": "venti",
            "lista_veicoli": [
                {
                    "tipologia": "macchina operatrice",
                    "nazione": "croazia",
                    "targa": "icsi ypsilon novecentottanta sette gettati",
                    "tipologia_targa": "ufficiale",
                    "marca_modello": "è vero l'espace",
                    "colore": null
                }
            ],
            "contestazione_immediata": "contestazione immediata",
            "motivo_mancata_contestazione": null,
            "violazioni": [
                {
                    "codice": "civile",
                    "articolo": "ventuno",
                    "comma": "diciannove",
                    "sanzione_accessoria": null
                }
            ],
            "punti": "sette",
            "tipo_stampa": "blood",
            "lingua_stampa": "spagnolo",
            "stampa_anche_comunicazione": "stampa anche la comunicazione"
        },
        "missing_required_infos": []
    },
    "original_transcribed_sentence": "procedo con la stesura di un verbale per il veicolo macchina operatrice marca è vero l'espace targato icsi ypsilon novecentottanta sette gettati di tipo ufficiale proveniente da croazia l'infrazione e stata rilevata il ventidue aprile duemilaventicinque alle ore tredici e ventiquattro il veicolo si trovava in via della repubblica venti via dei fori imperiali al civico dieci in parcheggia in doppia fila violando l'articolo ventuno comma diciannove del codice civile l'agente mario rossi a provveduto alla contestazione immediata dell'infrazione la violazione comporta la perdita di sette punti richiedo la stampa del verbale in spagnolo tramite blood stampa anche la comunicazione",
    "original_sentence": "Procedo con la stesura di un verbale per il veicolo macchina operatrice, marca Chevrolet Spark, targato XY987ZT (di tipo ufficiale), proveniente da croazia.  L'infrazione è stata rilevata il 22/04/2025 alle ore 13:24. Il veicolo si trovava in via della Repubblica, 20via dei Fori Imperiali, al civico 10, in parcheggio in doppia fila, violando l'articolo 21, comma 19, del codice civile. L'agente Mario Rossi ha provveduto alla contestazione immediata dell'infrazione. La violazione comporta la perdita di 7 punti.  Richiedo la stampa del verbale in spagnolo tramite bluetooth, stampa anche la comunicazione."
}