{
    "scraped_data": {
        "summary": "Il documento notifica un preavviso di violazione per un veicolo immatricolato in Francia. La violazione è avvenuta il 30 aprile 2025 alle 7:43 in via della Pace, civico 2, per parcheggio in zona a rimozione. La violazione è in base all'articolo 16, comma 14 del codice civile, con una decurtazione di 6 punti. Si richiede la stampa del preavviso in lingua spagnola tramite Bluetooth, includendo anche la comunicazione.",
        "report": {
            "verbale_preavviso": "preavviso",
            "data_violazione": "trenta aprile duemilaventicinque",
            "ora_violazione": "sette quarantatré",
            "Strada_1": "via della pace",
            "Civico_1": "due",
            "lista_veicoli": [
                {
                    "tipologia": "macchina operatrice",
                    "nazione": "francia",
                    "targa": "jeff trecentoventi uno giacca",
                    "tipologia_targa": "speciale",
                    "marca_modello": "onda cibi jerry seicentocinquanta",
                    "colore": null
                }
            ],
            "contestazione_immediata": null,
            "motivo_mancata_contestazione": null,
            "violazioni": [
                {
                    "codice": "civile",
                    "articolo": "sedici",
                    "comma": "quattordici",
                    "sanzione_accessoria": null
                }
            ],
            "punti": "sei",
            "tipo_stampa": "blu tutta",
            "lingua_stampa": "spagnolo",
            "stampa_anche_comunicazione": "stampa anche la comunicazione"
        },
        "missing_required_infos": []
    },
    "original_transcribed_sentence": "si notifica la presenza di un preavviso di violazione per il veicolo macchina operatrice marca onda cibi jerry seicentocinquanta targa è jeff trecentoventi uno giacca di tipo speciale immatricolati in francia la violazione è avvenuta il trenta aprile duemilaventicinque alle ore sette quarantatré in via della pace al numero civico due ed è relativa a parcheggio in zona a rimozione in base all'articolo sedici con ma quattordici del codice civile per tale violazione sono previsti sei punti di decurtazione si richiede la stampa di tale preavviso in lingua spagnolo tramite blu tutta stampa anche la comunicazione",
    "original_sentence": "Si notifica la presenza di un preavviso di violazione per il veicolo macchina operatrice, marca Honda CBR650R, targa EF321GH di tipo speciale, immatricolato in francia. La violazione è avvenuta il 30/04/2025 alle ore 07:43 in via della Pace, al numero civico 2, ed è relativa a parcheggio in zona rimozione, in base all'articolo 16, comma 14 del codice civile.Per tale violazione sono previsti 6 punti di decurtazione. Si richiede la stampa di tale preavviso in lingua spagnolo tramite bluetooth, stampa anche la comunicazione."
}