{
    "scraped_data": {
        "summary": "Il documento descrive un verbale redatto il 23 aprile 2025 alle 12:37 per un'infrazione accertata in via della Concordia, civico 13. La violazione riguarda il codice penale, articolo 42, comma 40, per transito in zona accesso vietato. Sono previsti tre punti da decurtare. Non è stata possibile una contestazione immediata per l'assenza del trasgressore. La stampa avviene tramite Bluetooth in francese e include anche la comunicativa.",
        "report": {
            "verbale_preavviso": "verbale",
            "data_violazione": "ventitré aprile duemilaventicinque",
            "ora_violazione": "mezzogiorno e trentasette",
            "Strada_1": "via della concordia",
            "Civico_1": "tredici",
            "lista_veicoli": [
                {
                    "tipologia": "autovettura",
                    "nazione": null,
                    "targa": "quattrocentocinquanta sei ho più",
                    "tipologia_targa": "prova",
                    "marca_modello": null,
                    "colore": null
                }
            ],
            "contestazione_immediata": null,
            "motivo_mancata_contestazione": "assenza del trasgressori",
            "violazioni": [
                {
                    "codice": "penale",
                    "articolo": "quarantadue",
                    "comma": "quaranta",
                    "sanzione_accessoria": null
                }
            ],
            "punti": "tre, before: previsti, after: da",
            "tipo_stampa": "blu",
            "lingua_stampa": "francese",
            "stampa_anche_comunicazione": "stampa anche la comunicativa"
        },
        "missing_required_infos": []
    },
    "original_transcribed_sentence": "alle mezzogiorno e trentasette del ventitré aprile duemilaventicinque storie di gendo un verbale per il veicolo autovettura targato quattrocentocinquanta sei ho più con targa prova immatricolati intrecciare infrazione e stata accertata inviarle della concordia al civico tredici con violazione del codice penale articolo quarantadue con ma quaranta per transito in zona accesso vietato sono previsti tre punti da decurtare non è stata possibile una contestazione immediata per l'assenza del trasgressori non posso applicare alcuna sanzione accessoria stampa tramite blu in francese stampa anche la comunicativa",
    "original_sentence": "Alle 12:37 del 23/04/2025, sto redigendo un verbale per il veicolo autovettura targato MN456OP con targa prova, immatricolato in greciaL'infrazione è stata accertata in viale della Concordia, al civico 13, con violazione del codice penale, articolo 42,comma 40 per transito in zona accesso vietato Sono previsti 3 punti da decurtare. Non è stata possibile una contestazione immediata per l'assenza del trasgressore. Non posso applicare alcuna sanzione accessoria. Stampa tramite bluetooth, in francese, stampa anche la comunicazione."
}