{
    "scraped_data": {
        "summary": "Il documento descrive un preavviso di violazione per un veicolo motoveicolo targato \"ti jerry zero nove otto i ypsilon nudi\", tipo ufficiale, proveniente dalla Slovenia, marca Volkswagen Polo. La violazione riguarda il transito in zona di accesso vietato, avvenuta il 9 aprile 2025 alle ore 19:44 in viale della Concordia, numero 13. L'infrazione è relativa all'articolo 17, comma 15 del codice stradale. Non è stato possibile contestare immediatamente a causa dell'assenza del trasgressore. La sanzione prevede la perdita di sette punti. Si richiede la stampa in lingua italiana tramite WiFi, senza stampare anche la comunicazione.",
        "report": {
            "verbale_preavviso": "preavviso",
            "data_violazione": "nove aprile duemilaventicinque",
            "ora_violazione": "diciannove e quarantaquattro",
            "Strada_1": "viale della concordia",
            "Civico_1": "tredici",
            "lista_veicoli": [
                {
                    "tipologia": "motoveicoli",
                    "nazione": "slovenia",
                    "targa": "ti jerry zero nove otto i ypsilon nudi",
                    "tipologia_targa": "ufficiali",
                    "marca_modello": "volkswagen polo",
                    "colore": null
                }
            ],
            "contestazione_immediata": null,
            "motivo_mancata_contestazione": "assenza del trasgressori",
            "violazioni": [
                {
                    "codice": "stradale",
                    "articolo": "diciassette",
                    "comma": "quindici",
                    "sanzione_accessoria": null
                }
            ],
            "punti": "sette",
            "tipo_stampa": "wifi",
            "lingua_stampa": "italiano",
            "stampa_anche_comunicazione": "non stampare anche la comunicazione"
        },
        "missing_required_infos": []
    },
    "original_transcribed_sentence": "si notifica un preavviso relativo al veicolo motoveicoli targato ti jerry zero nove otto i ypsilon nudi tipo ufficiali proveniente da slovenia marca volkswagen polo la violazione ovvero transito in zona accesso vietato si e verificata in data nove aprile duemilaventicinque alle ore diciannove e quarantaquattro in viale della concordia al numero tredici l'infrazione rientra nell'articolo diciassette comma quindici del codice stradale non è stato possibile contestare immediatamente a causa dell'assenza del trasgressori la sanzione prevede la perdita di sette punti si richiede la stampa in lingua italiano tramite wifi non stampare anche la comunicazione",
    "original_sentence": "Si notifica un preavviso relativo al veicolo motoveicolo targato TR098YU di tipo ufficiale proveniente da slovenia, marca Volkswagen Polo. La violazione, ovvero transito in zona accesso vietato, si è verificata in data 09/04/2025 alle ore 19:44 in viale della Concordia, al numero 13. L'infrazione rientra nell'articolo 17, comma 15 del codice stradale. Non è stato possibile contestare immediatamente a causa dell'assenza del trasgressore. La sanzione prevede la perdita di 7 punti. Si richiede la stampa in lingua italiano, tramite wifi, non stampare anche la comunicazione. "
}