{
    "scraped_data": {
        "summary": "Il documento notifica un preavviso di violazione per un motoveicolo marca Pegeout 208, targa ICSI Y387 SA, immatricolato in Croazia. La violazione è avvenuta il 30 aprile 2025 alle ore 12:43 in via della Speranza, numero civico 17, per parcheggio su strisce pedonali. La violazione è in base all'articolo 20 comma 18 del codice civile e prevede la decurtazione di nove punti. Si richiede la stampa del preavviso in lingua portoghese tramite Wi-Fi, senza stampare anche la comunicazione.",
        "report": {
            "verbale_preavviso": "preavviso",
            "data_violazione": "trenta aprile duemilaventicinque",
            "ora_violazione": "mezzogiorno e quarantatré",
            "Strada_1": "via della speranza",
            "Civico_1": "diciassette",
            "lista_veicoli": [
                {
                    "tipologia": "motoveicoli",
                    "nazione": "croazia",
                    "targa": "icsi ypsilon trecentottantasette sa",
                    "tipologia_targa": "prova",
                    "marca_modello": "peggio duecentotto",
                    "colore": null
                }
            ],
            "contestazione_immediata": null,
            "motivo_mancata_contestazione": null,
            "violazioni": [
                {
                    "codice": "civile",
                    "articolo": "venti",
                    "comma": "diciotto",
                    "sanzione_accessoria": null
                }
            ],
            "punti": "nove",
            "tipo_stampa": "vuoi fai",
            "lingua_stampa": "portoghese",
            "stampa_anche_comunicazione": "non stampare anche la comunicazione"
        },
        "missing_required_infos": []
    },
    "original_transcribed_sentence": "si notifica la presenza di un preavviso di violazione per il veicolo motoveicoli marca peggio duecentotto targa icsi ypsilon trecentottantasette sa di tipo prova immatricolati in croazia la violazione è avvenuta il trenta aprile duemilaventicinque alle ore mezzogiorno e quarantatré in via della speranza al numero civico diciassette ed è relativa a parcheggio su strisce pedonali in base al l'articolo venti comma diciotto del codice civile per tale violazione sono previsti nove punti di decurtazione si richiede la stampa di tale preavviso in lingua portoghese tramite vuoi fai non stampare anche la comunicazione",
    "original_sentence": "Si notifica la presenza di un preavviso di violazione per il veicolo motoveicolo, marca Peugeot 208, targa XY987ZA di tipo prova, immatricolato in croazia. La violazione è avvenuta il 30/04/2025 alle ore 12:43 in via della Speranza, al numero civico 17, ed è relativa a parcheggio su strisce pedonali, in base all'articolo 20, comma 18 del codice civile.Per tale violazione sono previsti 9 punti di decurtazione. Si richiede la stampa di tale preavviso in lingua portoghese tramite wifi, non stampare anche la comunicazione."
}