{
    "scraped_data": {
        "summary": "Il documento descrive un avviso di violazione per un veicolo con targa di prova registrato in Italia. L'infrazione è avvenuta il 14 aprile 2025 alle 8:27 in viale della Scienza, civico 14, per parcheggio in doppia fila. La violazione riguarda l'articolo 53, comma 51 del codice stradale e comporta la decurtazione di 2 punti. La stampa dell'avviso è prevista via Bluetooth in lingua tedesca, senza includere la comunicazione.",
        "report": {
            "verbale_preavviso": "preavviso",
            "data_violazione": "quattordici aprile duemilaventicinque",
            "ora_violazione": "otto e ventisette",
            "Strada_1": "viale della scienza",
            "Civico_1": "quattordici",
            "lista_veicoli": [
                {
                    "tipologia": "autovettura",
                    "nazione": "italia",
                    "targa": "guerre centoventitre",
                    "tipologia_targa": "prova",
                    "marca_modello": "mit subisci colte",
                    "colore": null
                }
            ],
            "contestazione_immediata": null,
            "motivo_mancata_contestazione": null,
            "violazioni": [
                {
                    "codice": "stradale",
                    "articolo": "cinquantatré",
                    "comma": "cinquantuno",
                    "sanzione_accessoria": null
                }
            ],
            "punti": "due",
            "tipo_stampa": "blu tutti",
            "lingua_stampa": "tedesco",
            "stampa_anche_comunicazione": "non stampare anche la comunicazione"
        },
        "missing_required_infos": []
    },
    "original_transcribed_sentence": "e metto un avviso di violazione quindi si tratta di un preavviso per il veicolo mit subisci colte autovettura targato guerre centoventitre se ti con targa prova registrato in italia per un fatto accaduto il quattordici aprile duemilaventicinque alle otto e ventisette il veicolo si trovava in viale della scienza al civico quattordici dove è stato riscontrato parcheggia in doppia fila in base all'articolo cinquantatré comma cinquantuno del codice stradale questa infrazione comporta una decurtazione di due punti genera alla stampa dell'avviso via blu tutti in tedesco non stampare anche la comunicazione",
    "original_sentence": "Emetto un avviso di violazione, quindi si tratta di un preavviso, per il veicolo Mitsubishi Colt, autovettura, targato QR123ST con targa prova, registrato in italia,  per un fatto accaduto il 14/04/2025 alle 08:27. Il veicolo si trovava in viale della Scienza, al civico 14, dove è stato riscontrato parcheggio in doppia fila, in base all'articolo 53, comma 51, del codice stradale. Questa infrazione comporta una decurtazione di 2 punti.  Genera la stampa dell'avviso via bluetooth in tedesco, non stampare anche la comunicazione."
}