{
    "scraped_data": {
        "summary": "Il documento descrive un verbale redatto il ventinove aprile duemilaventicinque alle ore mezzanotte cinquantaquattro per un'infrazione avvenuta in via della musica al civico diciotto. Il veicolo coinvolto è un'autovettura immatricolata in Portogallo con targa speciale. La violazione riguarda il codice stradale, articolo cinquantadue comma cinquanta, per parcheggio in doppia fila. La contestazione è stata immediata e sono previsti tre punti da decurtare. La stampa del verbale è in tedesco tramite Wi-Fi, senza comunicazione aggiuntiva.",
        "report": {
            "verbale_preavviso": "verbale",
            "data_violazione": "ventinove aprile duemilaventicinque",
            "ora_violazione": "mezzanotte cinquantaquattro",
            "Strada_1": "via della musica",
            "Civico_1": "diciotto, before: musica, after: stata",
            "lista_veicoli": [
                {
                    "tipologia": "autovettura",
                    "nazione": "portogallo",
                    "targa": "icsi ypsilon novecentottanta sette e mezza",
                    "tipologia_targa": "speciale",
                    "marca_modello": null,
                    "colore": null
                }
            ],
            "contestazione_immediata": "contestazione immediata",
            "motivo_mancata_contestazione": null,
            "violazioni": [
                {
                    "codice": "stradale",
                    "articolo": "cinquantadue, before: articolo, after: comma",
                    "comma": "cinquanta, before: comma, after: ovvero",
                    "sanzione_accessoria": null
                }
            ],
            "punti": "tre, before: previsti, after: da",
            "tipo_stampa": "vuoi fai",
            "lingua_stampa": "tedesco",
            "stampa_anche_comunicazione": "non stampare anche la comunicazione"
        },
        "missing_required_infos": []
    },
    "original_transcribed_sentence": "il giorno ventinove aprile duemilaventicinque alle ore mezzanotte cinquantaquattro è stato redatto un verbale per il veicolo chapas a chi getta seicentocinquanta autovettura immatricolati in portogallo con targa icsi ypsilon novecentottanta sette e mezza di tipo speciale l'infrazione e avvenuta in via della musica al civico diciotto stata riscontrata una violazione del codice stradale articolo cinquantadue comma cinquanta ovvero parcheggia in doppia fila verbale è stato eseguito sul posto con contestazione immediata da parte della gente luca verdi sono previsti tre punti da decurtare e non è stata applicata alcuna sanzione accessoria stampa in tedesco tramite vuoi fai non stampare anche la comunicazione",
    "original_sentence": "Il giorno 29/04/2025, alle ore 00:54, è stato redatto un verbale per il veicolo Kawasaki Z650, autovettura immatricolato in portogallo con targa XY987ZA di tipo speciale.L'infrazione è avvenuta in via della Musica, al civico 18. È stata riscontrata una violazione del codice stradale, articolo 52, comma 50 ovvero parcheggio in doppia filaIl verbale è stato eseguito sul posto, con contestazione immediata da parte dell'agente Luca Verdi. Sono previsti 3 punti da decurtare, e non è stata applicata alcuna sanzione accessoria. Stampa in tedesco tramite wifi, non stampare anche la comunicazione."
}