{
    "scraped_data": {
        "summary": "Il documento descrive una violazione accertata il 3 maggio 2025 alle ore 4:38 in viale della Scienza, civico 14. La violazione riguarda un veicolo Mercedes Classe A con targa ufficiale slovena, per parcheggio in zona a rimozione, secondo l'articolo 121, comma 9 del codice penale. La contestazione è stata immediata da parte dell'agente Carlo Bruni, con una decurtazione di sette punti. Si richiede la stampa in lingua inglese tramite WiFi, senza includere la comunicazione.",
        "report": {
            "verbale_preavviso": "verbale",
            "data_violazione": "tre maggio duemilaventicinque",
            "ora_violazione": "quattro e trentotto",
            "Strada_1": "viale della scienza",
            "Civico_1": "quattordici",
            "lista_veicoli": [
                {
                    "tipologia": "ciclomotori",
                    "nazione": "slovenia",
                    "targa": "i gia quattrocentocinquanta sei capelli",
                    "tipologia_targa": "ufficiale",
                    "marca_modello": "mercedes classe a",
                    "colore": null
                }
            ],
            "contestazione_immediata": "contestazione e avvenuta immediatamente",
            "motivo_mancata_contestazione": null,
            "violazioni": [
                {
                    "codice": "penale",
                    "articolo": "centoventi uno",
                    "comma": "nove",
                    "sanzione_accessoria": null
                }
            ],
            "punti": "sette",
            "tipo_stampa": "hawaii fai",
            "lingua_stampa": "inglese",
            "stampa_anche_comunicazione": "non stampare anche la comunicazione"
        },
        "missing_required_infos": []
    },
    "original_transcribed_sentence": "si sta dicendo verbale per violazione accertata il tre maggio duemilaventicinque alle ore quattro e trentotto in viale della scienza al civico quattordici a carico del veicolo mercedes classe a ciclomotori con targa i gia quattrocentocinquanta sei capelli di tipo ufficiale immatricolati slovenia la violazione contestata hai parcheggio in zona a rimozione in base all'articolo centoventi uno con ma nove del codice penale la contestazione e avvenuta immediatamente da parte della gente carlo bruni sono previsti sette punti di decurtazione si richiede la stampa in lingua inglese di hawaii fai non stampare anche la comunicazione",
    "original_sentence": "Si sta redigendo verbale per violazione accertata il 03/05/2025 alle ore 04:38 in viale della Scienza, al civico 14, a carico del veicolo Mercedes Classe A, ciclomotore con targa IJ456KL di tipo ufficiale, immatricolato in slovenia. La violazione contestata è parcheggio in zona rimozione, in base all'articolo 121, comma 9 del codice penale. La contestazione è avvenuta immediatamente da parte dell'agente Carlo Bruni. Sono previsti 7 punti di decurtazione. Si richiede la stampa in lingua inglese via wifi, non stampare anche la comunicazione. "
}