{
    "scraped_data": {
        "summary": "Il documento descrive un preavviso per una violazione stradale. La violazione riguarda un parcheggio davanti a un passo carrabile, avvenuta il 7 aprile 2025 alle ore 6:22 in via della Vittoria, numero civico 9. Il veicolo coinvolto è una macchina agricola con targa ufficiale proveniente dalla Croazia, marca Seta Rona. La contestazione è stata immediata da parte dell'agente Chiara Romano. La violazione rientra nell'articolo 13, comma 11 del codice stradale e comporta la perdita di dieci punti. Si richiede la stampa in lingua spagnola tramite Wi-Fi, includendo anche la comunicazione.",
        "report": {
            "verbale_preavviso": "preavviso",
            "data_violazione": "sette aprile duemilaventicinque",
            "ora_violazione": "sei ventidue",
            "Strada_1": "via della vittoria",
            "Civico_1": "nove",
            "lista_veicoli": [
                {
                    "tipologia": "macchina agricola",
                    "nazione": "croazia",
                    "targa": "guerra e quattrocentocinquanta sei e se ti",
                    "tipologia_targa": "ufficiale",
                    "marca_modello": "seta rona",
                    "colore": null
                }
            ],
            "contestazione_immediata": "contestazione immediata",
            "motivo_mancata_contestazione": null,
            "violazioni": [
                {
                    "codice": "stradale",
                    "articolo": "tredici",
                    "comma": "undici",
                    "sanzione_accessoria": null
                }
            ],
            "punti": "dieci",
            "tipo_stampa": "guai fai",
            "lingua_stampa": "spagnolo",
            "stampa_anche_comunicazione": "stampa anche la comunicazione"
        },
        "missing_required_infos": []
    },
    "original_transcribed_sentence": "si notifica un preavviso relativo al veicolo macchina agricola targato guerra e quattrocentocinquanta sei e se ti di tipo ufficiale proveniente da croazia marca seta rona la violazione ovvero parcheggio davanti a passo cary abile si e verificata in data sette aprile duemilaventicinque alle ore sei ventidue inviare della vittoria al numero nove l'infrazione rientra nell'articolo tredici con ma undici del codice stradale contestazione immediata da parte della gente chiara romano la sanzione prevede la perdita di dieci punti si richiede la stampa in lingua spagnolo tramite guai fai stampa anche la comunicazione",
    "original_sentence": "Si notifica un preavviso relativo al veicolo macchina agricola targato QR456ST di tipo ufficiale proveniente da croazia, marca Seat Arona. La violazione, ovvero parcheggio davanti a passo carrabile, si è verificata in data 07/04/2025 alle ore 06:22 in viale della Vittoria, al numero 9. L'infrazione rientra nell'articolo 13, comma 11 del codice stradale. Contestazione immediata da parte dell'agente Chiara Romano. La sanzione prevede la perdita di 10 punti. Si richiede la stampa in lingua spagnolo, tramite wifi, stampa anche la comunicazione. "
}