{
    "scraped_data": {
        "summary": "Il documento descrive un preavviso notificato il cinque maggio duemilaventicinque alle ore cinque e trentaquattro per un'infrazione rilevata in via Roma, civico settantasette. La violazione riguarda il codice penale, articolo ventidue, con parcheggio in doppia fila. Non è stato possibile contestare immediatamente per l'assenza del trasgressore. Il veicolo coinvolto è una macchina agricola Success Vi 650 di colore marrone, immatricolata in Svizzera, con targa ufficiale. Sono da decurtare due punti. La stampa del preavviso è richiesta tramite Bluetooth in olandese, con inclusione della comunicazione.",
        "report": {
            "verbale_preavviso": "preavviso",
            "data_violazione": "cinque maggio duemilaventicinque",
            "ora_violazione": "cinque trentaquattro",
            "Strada_1": "via roma",
            "Civico_1": "settantasette",
            "lista_veicoli": [
                {
                    "tipologia": "macchina agricola",
                    "nazione": "svizzera",
                    "targa": "centoventitre ho più",
                    "tipologia_targa": "ufficiale",
                    "marca_modello": "success vi seicentocinquanta",
                    "colore": "marrone"
                }
            ],
            "contestazione_immediata": null,
            "motivo_mancata_contestazione": "assenza del trasgressori",
            "violazioni": [
                {
                    "codice": "penale",
                    "articolo": "ventidue",
                    "comma": null,
                    "sanzione_accessoria": null
                }
            ],
            "punti": "due, before: decurtare, after: punti",
            "tipo_stampa": "blu tutta",
            "lingua_stampa": "olandese",
            "stampa_anche_comunicazione": "stampa anche la comunicazione"
        },
        "missing_required_infos": []
    },
    "original_transcribed_sentence": "in data cinque maggio duemilaventicinque alle ore cinque trentaquattro è stato notificato un preavviso per un macchina agricola targato centoventitre ho più con targa ufficiale immatricolati in svizzera l'infrazione stata rilevata in via roma al civico settantasette con violazione del codice penale articolo ventidue commoventi in particolare si e riscontrato un parcheggio in doppia fila non è stato possibile contestare per l'assenza del trasgressori da decurtare ci sono due punti il veicolo è un success vi seicentocinquanta di colore marrone con numero di telaio quattrocentonovanta milioni e centocinquantacinque mila centouno e massa duemila e novecentodieci chilogrammi necessita la stampa del preavviso tramite blu tutta in olandese stampa anche la comunicazione",
    "original_sentence": "In data 05/05/2025, alle ore 05:34, è stato notificato un preavviso per un macchina agricola targato MN123OP con targa ufficiale, immatricolato in svizzera. L'infrazione è stata rilevata in via Roma, al civico 77, con violazione del codice penale, articolo 22, comma 20, in particolare si è riscontrato un parcheggio in doppia fila Non è stato possibile contestare per l'assenza del trasgressore. Da decurtare ci sono 2 punti. Il veicolo è un Suzuki SV650 di colore marrone, con numero di telaio 490155101 e massa 2910 kg.Necessito la stampa del preavviso tramite bluetooth, in olandese, stampa anche la comunicazione."
}