{
    "scraped_data": {
        "summary": "Il documento descrive un verbale per una violazione accertata il cinque maggio 2025 alle ore dieci e ventitré. La violazione è avvenuta in India Nea al civico quarantacinque, riguardante un veicolo operatrice con targa olandese. La violazione contestata è il parcheggio in divieto di sosta secondo l'articolo 66, comma 14 del codice civile. La contestazione è stata immediata da parte dell'agente Bellini, con una decurtazione di sei punti. La stampa richiesta è in lingua tedesca via Bluetooth, senza comunicazione aggiuntiva.",
        "report": {
            "verbale_preavviso": "verbali",
            "data_violazione": "cinque maggio duemilaventicinque",
            "ora_violazione": "dieci e ventitré",
            "Strada_1": "india nea",
            "Civico_1": "quarantacinque",
            "lista_veicoli": [
                {
                    "tipologia": "macchina operatrice",
                    "nazione": "olanda",
                    "targa": "quattrocentocinquanta sei ci di di",
                    "tipologia_targa": "ufficiale",
                    "marca_modello": null,
                    "colore": null
                }
            ],
            "contestazione_immediata": "contestazione avvenuta immediatamente",
            "motivo_mancata_contestazione": null,
            "violazioni": [
                {
                    "codice": "civile",
                    "articolo": "sisi",
                    "comma": "quattordici",
                    "sanzione_accessoria": null
                }
            ],
            "punti": "sei, before: previsti, after: di",
            "tipo_stampa": "vi about",
            "lingua_stampa": "tedesco",
            "stampa_anche_comunicazione": "non stampare anche la comunicazione"
        },
        "missing_required_infos": []
    },
    "original_transcribed_sentence": "si stare dicendo verbali per violazioni accertata il cinque maggio duemilaventicinque alle ore dieci e ventitré india nea al civico quarantacinque a carico del veicolo far festa macchina operatrice con targa quattrocentocinquanta sei ci di di tipo ufficiale immatricolati in olanda la violazione contestata hai parcheggiato in divieto di sosta in base a l'articolo sisi con ma quattordici del codice civile la contestazione avvenuta immediatamente da parte della gente sara bellini sono previsti sei punti di decurtazione si richiede la stampa in lingua tedesco vi about non stampare anche la comunicazione",
    "original_sentence": "Si sta redigendo verbale per violazione accertata il 05/05/2025 alle ore 10:23 in via Etnea, al civico 45, a carico del veicolo Ford Fiesta, macchina operatrice con targa AB456CD di tipo ufficiale, immatricolato in olanda. La violazione contestata è parcheggio in divieto di sosta, in base all'articolo 16, comma 14 del codice civile. La contestazione è avvenuta immediatamente da parte dell'agente Sara Bellini. Sono previsti 6 punti di decurtazione. Si richiede la stampa in lingua tedesco via bluetooth, non stampare anche la comunicazione. "
}