{
    "scraped_data": {
        "summary": "Il documento descrive la stesura di un verbale per un veicolo speciale proveniente dalla Slovenia, targato guerre novecentottanta sette se ti. L'infrazione è stata rilevata il ventiquattro aprile duemilaventicinque alle ore quattordici e ventotto in via della cultura al civico nove. La violazione riguarda l'articolo tre, comma uno del codice stradale. L'agente Mario Rossi ha provveduto alla contestazione immediata. La violazione comporta la perdita di uno punti. Si richiede la stampa del verbale in spagnolo tramite Bluetooth, includendo anche la comunicazione.",
        "report": {
            "verbale_preavviso": "verbale",
            "data_violazione": "ventiquattro aprile duemilaventicinque",
            "ora_violazione": "quattordici e ventotto",
            "Strada_1": "via della cultura",
            "Civico_1": "nove",
            "lista_veicoli": [
                {
                    "tipologia": "speciale",
                    "nazione": "slovenia",
                    "targa": "guerre novecentottanta sette se ti",
                    "tipologia_targa": null,
                    "marca_modello": null,
                    "colore": null
                }
            ],
            "contestazione_immediata": "contestazione immediata",
            "motivo_mancata_contestazione": null,
            "violazioni": [
                {
                    "codice": "stradale",
                    "articolo": "tre",
                    "comma": "uno",
                    "sanzione_accessoria": null
                }
            ],
            "punti": "uno, before: di, after: punti",
            "tipo_stampa": "blu tutta",
            "lingua_stampa": "spagnolo",
            "stampa_anche_comunicazione": "stampa anche la comunicazione"
        },
        "missing_required_infos": []
    },
    "original_transcribed_sentence": "procedo con la stesura di un verbale per il veicolo molto veicolo marcare no ho capito targato guerre novecentottanta sette se ti di tipo speciale proveniente da slovenia l'infrazione e stata rilevata il ventiquattro aprile duemilaventicinque alle ore quattordici e ventotto il veicolo si trovava in via della cultura al civico nove in parcheggio davanti a pasto carabine violando l'articolo tre con ma uno del codice stradale l'agente mario rossi a provveduto alla contestazione immediata dell'infrazione la violazione comporta la perdita di uno punti richiedo la stampa del verbale in spagnolo tramite blu tutta stampa anche la comunicazione",
    "original_sentence": "Procedo con la stesura di un verbale per il veicolo motoveicolo, marca Renault Captur, targato QR987ST (di tipo speciale), proveniente da slovenia.  L'infrazione è stata rilevata il 24/04/2025 alle ore 14:28. Il veicolo si trovava in via della Cultura, al civico 9, in parcheggio davanti a passo carrabile, violando l'articolo 3, comma 1, del codice stradale. L'agente Mario Rossi ha provveduto alla contestazione immediata dell'infrazione. La violazione comporta la perdita di 1 punti.  Richiedo la stampa del verbale in spagnolo tramite bluetooth, stampa anche la comunicazione."
}