{
    "scraped_data": {
        "summary": "Il verbale è stato redatto il diciannove aprile duemilaventicinque alle ore diciassette e quarantacinque per una violazione riscontrata al veicolo \"macchina operatrice\" marca \"un dai venti\" targato \"gia sette centottantanove\" proveniente dall'Austria. La violazione è avvenuta in via Garibaldi, civico undici, per transito in zona di accesso vietato, in violazione dell'articolo tredici, comma undici del codice civile. L'agente Bellini ha proceduto con contestazione immediata e si prevede la decurtazione di quattro punti dalla patente. La stampa è richiesta in italiano via \"hawaii\" e include anche la comunicazione.",
        "report": {
            "verbale_preavviso": "verbale",
            "data_violazione": "diciannove aprile duemilaventicinque",
            "ora_violazione": "diciassette quarantacinque",
            "Strada_1": "via garibaldi",
            "Civico_1": "undici",
            "lista_veicoli": [
                {
                    "tipologia": "macchina operatrice",
                    "nazione": "austria",
                    "targa": "gia sette centottantanove",
                    "tipologia_targa": null,
                    "marca_modello": "un dai venti",
                    "colore": null
                }
            ],
            "contestazione_immediata": "contestazione immediata",
            "motivo_mancata_contestazione": null,
            "violazioni": [
                {
                    "codice": "civile",
                    "articolo": "tredici",
                    "comma": "undici",
                    "sanzione_accessoria": null
                }
            ],
            "punti": "quattro, before: decurtazione, after: punti",
            "tipo_stampa": "hawaii",
            "lingua_stampa": "italiano",
            "stampa_anche_comunicazione": "stampa anche la comunicazione"
        },
        "missing_required_infos": []
    },
    "original_transcribed_sentence": "verbale redatto in data diciannove aprile duemilaventicinque alle ore diciassette quarantacinque per la violazione riscontrata al veicolo macchina operatrice marca un dai venti targato gia sette centottantanove tipo copertura proveniente da austria in particolare in via garibaldi civico undici è stato accertato transito in zona accesso vietato in violazione dell'articolo tredici con ma undici del codice civile l'agente sarà bellini a proceduto con contestazione immediata si prevede la decurtazione di quattro punti dalla patente richiedo la stampa in italiano via hawaii fai stampa anche la comunicazione",
    "original_sentence": "Verbale redatto in data 19/04/2025 alle ore 17:45 per la violazione riscontrata al veicolo macchina operatrice, marca Hyundai i20, targato GH789IJ (tipo copertura) proveniente da austria. In particolare, in via Garibaldi, civico 11, è stato accertato transito in zona accesso vietato, in violazione dell'articolo 13, comma 11 del codice civile. L'agente Sara Bellini ha proceduto con contestazione immediata. Si prevede la decurtazione di 4 punti dalla patente. Richiedo la stampa in italiano via wifi, stampa anche la comunicazione."
}