{
    "scraped_data": {
        "summary": "Il documento descrive un avviso di violazione per un veicolo con rimorchio targato UBI 4506 EX, registrato in Croazia. L'infrazione è avvenuta il 29 aprile 2025 alle 10:25 in Corso della Giustizia, civico 23, per parcheggio in zona a rimozione. La violazione è in base all'articolo 31 del codice civile, comma 30, e comporta una decurtazione di 1 punto. La stampa dell'avviso è prevista via Bluetooth in spagnolo, senza includere la comunicazione.",
        "report": {
            "verbale_preavviso": "preavviso",
            "data_violazione": "ventinove aprile duemilaventicinque",
            "ora_violazione": "dieci e venticinque",
            "Strada_1": "corso della giustizia",
            "Civico_1": "ventitre",
            "lista_veicoli": [
                {
                    "tipologia": "rimorchio",
                    "nazione": "croazia",
                    "targa": "ubi quattrocentocinquanta sei doppia ex",
                    "tipologia_targa": "copertura",
                    "marca_modello": null,
                    "colore": null
                }
            ],
            "contestazione_immediata": null,
            "motivo_mancata_contestazione": null,
            "violazioni": [
                {
                    "codice": "civile",
                    "articolo": "trentuno",
                    "comma": "trenta",
                    "sanzione_accessoria": null
                }
            ],
            "punti": "uno",
            "tipo_stampa": "blu tutti",
            "lingua_stampa": "spagnolo",
            "stampa_anche_comunicazione": "non stampare anche la comunicazione"
        },
        "missing_required_infos": []
    },
    "original_transcribed_sentence": "e metto un avviso di violazione quindi si tratta di un preavviso per il veicolo se le tracy rimorchio targato ubi quattrocentocinquanta sei doppia ex con targa copertura registrato in croazia per un fatto accaduto il ventinove aprile duemilaventicinque alle dieci e venticinque il veicolo si trovava in corso della giustizia al civico ventitre dove è stato riscontrato parcheggio in zona a rimozione in base all'articolo trentuno duemilanovecento trentadue con ma trenta del codice civile questa infrazione comporta una decurtazione di uno punti genere alla stampa dell'avviso via blu tutti in spagnolo non stampare anche la comunicazione",
    "original_sentence": "Emetto un avviso di violazione, quindi si tratta di un preavviso, per il veicolo Chevrolet Trax, rimorchio, targato UV456WX con targa copertura, registrato in croazia,  per un fatto accaduto il 29/04/2025 alle 10:25. Il veicolo si trovava in corso della Giustizia, al civico 23, dove è stato riscontrato parcheggio in zona rimozione, in base all'articolo 31, 2932, comma 30, del codice civile. Questa infrazione comporta una decurtazione di 1 punti.  Genera la stampa dell'avviso via bluetooth in spagnolo, non stampare anche la comunicazione."
}