{
    "scraped_data": {
        "summary": "Il documento descrive l'emissione di un preavviso per una violazione di transito in zona accesso vietato. La violazione è stata rilevata il dieci aprile duemilaventicinque alle ore ventiquattro e diciassette in piazza Venezia, numero uno. Il veicolo coinvolto è una macchina operatrice marca Onda, targata quattrocentocinquanta sei oppido, tipo ufficiale, proveniente dalla Germania. La violazione riguarda l'articolo centottantacinque, comma due del codice civile, con una decurtazione di sei punti. Si richiede la stampa del preavviso tramite Wi-Fi in lingua portoghese, includendo anche la comunicazione.",
        "report": {
            "verbale_preavviso": "preavviso",
            "data_violazione": "dieci aprile duemilaventicinque",
            "ora_violazione": "ventiquattro e diciassette",
            "Strada_1": "piazza venezia",
            "Civico_1": "uno",
            "lista_veicoli": [
                {
                    "tipologia": "macchina operatrice",
                    "nazione": "germania",
                    "targa": "quattrocentocinquanta sei oppido",
                    "tipologia_targa": "ufficiale",
                    "marca_modello": "onda",
                    "colore": null
                }
            ],
            "contestazione_immediata": null,
            "motivo_mancata_contestazione": null,
            "violazioni": [
                {
                    "codice": "civile",
                    "articolo": "centottantacinque",
                    "comma": "due",
                    "sanzione_accessoria": null
                }
            ],
            "punti": "sei",
            "tipo_stampa": "guai fai",
            "lingua_stampa": "portoghese",
            "stampa_anche_comunicazione": "stampa anche la comunicazione"
        },
        "missing_required_infos": []
    },
    "original_transcribed_sentence": "emissione di preavviso per il veicolo macchina operatrice marca onda targato quattrocentocinquanta sei oppido tipo ufficiale proveniente da germania in data dieci aprile duemilaventicinque alle ore ventiquattro e diciassette e stata rilevata la violazione di transito in zona accesso vietato in piazza venezia a numero uno in base alle articolo centottantacinque con ma due del codice civile per tale infrazione sono previsti sei punti di decurtazione si richiede la stampa del preavviso tramite guai fai in lingua portoghese stampa anche la comunicazione",
    "original_sentence": "Emissione di preavviso per il veicolo macchina operatrice, marca Honda Jazz, targato MN456OP di tipo ufficiale, proveniente da germania. In data 10/04/2025 alle ore 00:17, è stata rilevata la violazione di transito in zona accesso vietato in piazza Venezia, al numero 1, in base all'articolo 185, comma 2 del codice civile. Per tale infrazione sono previsti 6 punti di decurtazione. Si richiede la stampa del preavviso tramite wifi in lingua portoghese, stampa anche la comunicazione. "
}