{
    "scraped_data": {
        "summary": "Il documento riguarda la stesura di un preavviso di violazione per un veicolo proveniente dalla Svizzera. L'infrazione è avvenuta l'11 aprile 2025 alle 00:27 in Corso della Storia, numero 22. La violazione riguarda il transito in zona di accesso vietato, violando l'articolo 3, comma 1 del codice stradale. La violazione comporterà una decurtazione di due punti. Si richiede la stampa in lingua italiana, modalità Hawaii, e di non stampare anche la comunicazione.",
        "report": {
            "verbale_preavviso": "preavviso",
            "data_violazione": "undici aprile duemilaventicinque",
            "ora_violazione": "mezzanotte ventisette",
            "Strada_1": "corso della storia",
            "Civico_1": "ventidue",
            "lista_veicoli": [
                {
                    "tipologia": "macchina operatrice",
                    "nazione": "svizzera",
                    "targa": "ubi sette centottantanove doppia ex",
                    "tipologia_targa": "prova",
                    "marca_modello": "un dai venti",
                    "colore": null
                }
            ],
            "contestazione_immediata": null,
            "motivo_mancata_contestazione": null,
            "violazioni": [
                {
                    "codice": "stradale",
                    "articolo": "tre",
                    "comma": "uno",
                    "sanzione_accessoria": null
                }
            ],
            "punti": "due",
            "tipo_stampa": "hawaii",
            "lingua_stampa": "italiano",
            "stampa_anche_comunicazione": "non stampare anche la comunicazione"
        },
        "missing_required_infos": []
    },
    "original_transcribed_sentence": "si avvisa che è in corso la stesura di un preavviso di violazione per il veicolo macchina operatrice con targa ubi sette centottantanove doppia ex di tipo prova marca un dai venti proveniente da svizzera l'infrazione nello specifico transito in zona accesso vietato sia e verificata in data undici aprile duemilaventicinque alle ore mezzanotte ventisette in corso della storia al numero ventidue articolo tre con ma uno del codice stradale si comunica che dalla violazione conseguirà una decurtazione di due punti si richiede la stampa in lingua italiano modalità hawaii fai non stampare anche la comunicazione",
    "original_sentence": "Si avvisa che è in corso la stesura di un preavviso di violazione per il veicolo macchina operatrice con targa UV789WX di tipo prova, marca Hyundai i20, proveniente da svizzera. L'infrazione, nello specifico transito in zona accesso vietato, si è verificata in data 11/04/2025 alle ore 00:27 in corso della Storia, al numero 22 (articolo 3, comma 1 del codice stradale). Si comunica che dalla violazione conseguirà una decurtazione di 2 punti.Si richiede la stampa in lingua italiano, modalità wifi, non stampare anche la comunicazione."
}