{
    "scraped_data": {
        "summary": "Il documento notifica un preavviso di violazione per un veicolo macchina agricola con targa sette centottantanove occhi, immatricolato in Portogallo. La violazione è avvenuta il 20 aprile 2025 alle 18:50 in via della Speranza, numero civico 18, per parcheggio su strisce pedonali, in base all'articolo 36, comma 34 del codice civile. Sono previsti tre punti di decurtazione. Si richiede la stampa del preavviso in lingua inglese tramite Wi-Fi, senza stampare anche la comunicazione.",
        "report": {
            "verbale_preavviso": "preavviso",
            "data_violazione": "venti aprile duemilaventicinque",
            "ora_violazione": "diciotto e cinquanta",
            "Strada_1": "via della speranza",
            "Civico_1": "diciotto",
            "lista_veicoli": [
                {
                    "tipologia": "macchina agricola",
                    "nazione": "portogallo",
                    "targa": "sette centottantanove occhi",
                    "tipologia_targa": "copertura",
                    "marca_modello": "nucleo",
                    "colore": null
                }
            ],
            "contestazione_immediata": null,
            "motivo_mancata_contestazione": null,
            "violazioni": [
                {
                    "codice": "civile",
                    "articolo": "trentasei",
                    "comma": "trentaquattro",
                    "sanzione_accessoria": null
                }
            ],
            "punti": "tre",
            "tipo_stampa": "guai fai",
            "lingua_stampa": "inglese",
            "stampa_anche_comunicazione": "non stampare anche la comunicazione"
        },
        "missing_required_infos": []
    },
    "original_transcribed_sentence": "si notifica la presenza di un preavviso di violazione per il veicolo macchina agricola marcare nucleo targa sette centottantanove occhi di tipo copertura immatricolati portogallo la violazione è avvenuta il venti aprile duemilaventicinque alle ore diciotto e cinquanta in via della speranza al numero civico diciotto ed è relativa a parcheggio su strisce pedonali in base all'articolo trentasei ma trentaquattro del codice civile per tale violazione sono previsti tre punti di decurtazione si richiede la stampa di tale preavviso in lingua inglese tramite guai fai non stampare anche la comunicazione",
    "original_sentence": "Si notifica la presenza di un preavviso di violazione per il veicolo macchina agricola, marca Renault Clio, targa MN789OP di tipo copertura, immatricolato in portogallo. La violazione è avvenuta il 20/04/2025 alle ore 18:50 in via della Speranza, al numero civico 18, ed è relativa a parcheggio su strisce pedonali, in base all'articolo 36, comma 34 del codice civile.Per tale violazione sono previsti 3 punti di decurtazione. Si richiede la stampa di tale preavviso in lingua inglese tramite wifi, non stampare anche la comunicazione."
}