{
    "scraped_data": {
        "summary": "Il documento notifica un preavviso di violazione per un veicolo immatricolato in Austria. La violazione è avvenuta il 30 aprile 2025 alle 5:41 in corso Vittorio Emanuele, civico 15, per parcheggio davanti a passo carabine. La violazione è in base all'articolo 36, comma 34 del codice penale, con una decurtazione di 4 punti. Si richiede la stampa del preavviso in lingua olandese tramite WiFi, includendo anche la comunicazione.",
        "report": {
            "verbale_preavviso": "preavviso",
            "data_violazione": "trenta aprile duemilaventicinque",
            "ora_violazione": "cinque quarantuno",
            "Strada_1": "corso vittorio emanuele",
            "Civico_1": "quindici",
            "lista_veicoli": [
                {
                    "tipologia": "autovettura",
                    "nazione": "austria",
                    "targa": "un novecentottanta sette dopo mix",
                    "tipologia_targa": "copertura",
                    "marca_modello": "scorda fabia",
                    "colore": null
                }
            ],
            "contestazione_immediata": null,
            "motivo_mancata_contestazione": null,
            "violazioni": [
                {
                    "codice": "penale",
                    "articolo": "trentasei",
                    "comma": "trentaquattro",
                    "sanzione_accessoria": null
                }
            ],
            "punti": "quattro",
            "tipo_stampa": "wifi",
            "lingua_stampa": "olandese",
            "stampa_anche_comunicazione": "stampa anche la comunicazione"
        },
        "missing_required_infos": []
    },
    "original_transcribed_sentence": "si notifica la presenza di un preavviso di violazione per il veicolo autovettura marca scorda fabia targa un novecentottanta sette dopo mix di tipo copertura immatricolati in austria la violazione è avvenuta il trenta aprile duemilaventicinque alle ore cinque quarantuno in corso vittorio emanuele al numero civico quindici ed è relativa parcheggia davanti a passo carabine in base all'articolo trentasei comma trentaquattro del codice penale per tale violazione sono previsti quattro punti di decurtazione si richiede la stampa di tale preavviso in lingua olandese tramite wifi stampa anche la comunicazione",
    "original_sentence": "Si notifica la presenza di un preavviso di violazione per il veicolo autovettura, marca Skoda Fabia, targa UV987WX di tipo copertura, immatricolato in austria. La violazione è avvenuta il 30/04/2025 alle ore 05:41 in corso Vittorio Emanuele, al numero civico 15, ed è relativa a parcheggio davanti a passo carrabile, in base all'articolo 36, comma 34 del codice penale. Per tale violazione sono previsti 4 punti di decurtazione. Si richiede la stampa di tale preavviso in lingua olandese tramite wifi, stampa anche la comunicazione. "
}