{
    "scraped_data": {
        "summary": "Il documento notifica un preavviso di violazione per un veicolo immatricolato in Svizzera. La violazione è avvenuta il 7 maggio 2025 alle 10:58 in via della Scienza, civico 14, per parcheggio in divieto di sosta. La violazione riguarda l'articolo 31, comma 30 del codice civile, con una decurtazione di 9 punti. Si richiede la stampa del preavviso in lingua francese tramite Bluetooth, senza stampare la comunicazione.",
        "report": {
            "verbale_preavviso": "preavviso",
            "data_violazione": "sette maggio duemilaventicinque",
            "ora_violazione": "dieci e cinquantotto",
            "Strada_1": "viale della scienza",
            "Civico_1": "quattordici",
            "lista_veicoli": [
                {
                    "tipologia": "macchina operatrice",
                    "nazione": "svizzera",
                    "targa": "guerre trecentoventi uno e se ti",
                    "tipologia_targa": "copertura",
                    "marca_modello": "subaru",
                    "colore": null
                }
            ],
            "contestazione_immediata": null,
            "motivo_mancata_contestazione": null,
            "violazioni": [
                {
                    "codice": "civile",
                    "articolo": "trentuno",
                    "comma": "trenta",
                    "sanzione_accessoria": null
                }
            ],
            "punti": "nove, before: previsti, after: di",
            "tipo_stampa": "blu tutta",
            "lingua_stampa": "francese",
            "stampa_anche_comunicazione": "non stampare anche la comunicazione"
        },
        "missing_required_infos": []
    },
    "original_transcribed_sentence": "si notifica la presenza di un preavviso di violazione per il veicolo macchina operatrice marca subaru quindicesimo targa guerre trecentoventi uno e se ti di tipo copertura immatricolati in svizzera la violazione è avvenuta il sette maggio duemilaventicinque alle ore dieci e cinquantotto inviarle della scienza al numero civico quattordici ed è relativa parcheggiato in divieto di sosta in base all'articolo trentuno duemilanovecento trentadue comma trenta del codice civile per tale violazione sono previsti nove punti di decurtazione si richiede la stampa di tale preavviso in lingua francese tramite blu tutta non stampare anche la comunicazione",
    "original_sentence": "Si notifica la presenza di un preavviso di violazione per il veicolo macchina operatrice, marca Subaru XV, targa QR321ST di tipo copertura, immatricolato in svizzera. La violazione è avvenuta il 07/05/2025 alle ore 10:58 in viale della Scienza, al numero civico 14, ed è relativa a parcheggio in divieto di sosta, in base all'articolo 31, 2932, comma 30 del codice civile.Per tale violazione sono previsti 9 punti di decurtazione. Si richiede la stampa di tale preavviso in lingua francese tramite bluetooth, non stampare anche la comunicazione."
}