{
    "scraped_data": {
        "summary": "Il documento descrive la stesura di un verbale per un'infrazione rilevata il 23 aprile 2025 alle ore 6:47. Il veicolo coinvolto è una macchina operatrice proveniente dalla Svizzera, parcheggiata in doppia fila in viale della Concordia, civico 13. La violazione riguarda l'articolo 42, comma 40 del codice penale e comporta la perdita di 4 punti. Non è stata possibile la contestazione immediata a causa dell'assenza del trasgressore. Si richiede la stampa del verbale in olandese tramite WiFi, senza stampare anche la comunicazione.",
        "report": {
            "verbale_preavviso": "verbale",
            "data_violazione": "ventitré aprile duemilaventicinque",
            "ora_violazione": "sei quarantasette",
            "Strada_1": "viale della concordia",
            "Civico_1": "tredici",
            "lista_veicoli": [
                {
                    "tipologia": "macchina operatrice",
                    "nazione": "svizzera",
                    "targa": "trecentoventi",
                    "tipologia_targa": null,
                    "marca_modello": "mi subisci",
                    "colore": null
                }
            ],
            "contestazione_immediata": null,
            "motivo_mancata_contestazione": "assenza del trasgressori",
            "violazioni": [
                {
                    "codice": "penale",
                    "articolo": "quarantadue",
                    "comma": "quaranta",
                    "sanzione_accessoria": null
                }
            ],
            "punti": "quattro",
            "tipo_stampa": "fai",
            "lingua_stampa": "olandese",
            "stampa_anche_comunicazione": "non stampare anche la comunicazione"
        },
        "missing_required_infos": []
    },
    "original_transcribed_sentence": "procedo con la stesura di un verbale per il veicolo macchina operatrice marca mi subisci ex targato trecentoventi un'opera di tipo copertura proveniente da svizzera l'infrazione e stata rilevata il ventitré aprile duemilaventicinque alle ore sei quarantasette il veicolo si trovava in viale della concordia al civico tredici in parcheggia in doppia fila violando l'articolo quarantadue coma quaranta del codice penale non è stato possibile effettuare la contestazione immediata causa dell'assenza del trasgressori la violazione comporta la perdita di quattro punti richiedo la stampa del verbale in olandese tramite fai non stampare anche la comunicazione",
    "original_sentence": "Procedo con la stesura di un verbale per il veicolo macchina operatrice, marca Mitsubishi ASX, targato MN321OP (di tipo copertura), proveniente da svizzera. L'infrazione è stata rilevata il 23/04/2025 alle ore 06:47. Il veicolo si trovava in viale della Concordia, al civico 13, in parcheggio in doppia fila, violando l'articolo 42, comma 40, del codice penale. Non è stato possibile effettuare la contestazione immediata a causa dell'assenza del trasgressore. La violazione comporta la perdita di 4 punti. Richiedo la stampa del verbale in olandese tramite wifi, non stampare anche la comunicazione. "
}