{
    "scraped_data": {
        "summary": "Il documento descrive un'infrazione accertata il sedici aprile duemilaventicinque alle otto e tredici. Un verbale è stato redatto per un veicolo macchina agricola con targa speciale immatricolata in Portogallo, targato i sette centottantanove capelli. La violazione è avvenuta in via della giustizia al civico sedici, riguardante il codice civile, articolo trentaquattro, comma trentadue, per parcheggio in divieto di sosta. Sono previsti sei punti da decurtare. Non è stata possibile una contestazione immediata per l'assenza del trasgressore. La stampa avviene tramite Bluetooth in tedesco e include anche la comunicazione.",
        "report": {
            "verbale_preavviso": "verbale",
            "data_violazione": "sedici aprile duemilaventicinque",
            "ora_violazione": "otto e tredici",
            "Strada_1": "via della giustizia",
            "Civico_1": "sedici",
            "lista_veicoli": [
                {
                    "tipologia": "macchina agricola",
                    "nazione": "portogallo",
                    "targa": "i sette centottantanove capelli",
                    "tipologia_targa": "speciale",
                    "marca_modello": null,
                    "colore": null
                }
            ],
            "contestazione_immediata": null,
            "motivo_mancata_contestazione": "assenza del trasgressori",
            "violazioni": [
                {
                    "codice": "civile",
                    "articolo": "trentaquattro",
                    "comma": "trentadue",
                    "sanzione_accessoria": null
                }
            ],
            "punti": "sei, before: previsti, after: da",
            "tipo_stampa": "piu tutte",
            "lingua_stampa": "tedesco",
            "stampa_anche_comunicazione": "stampa anche la comunicazione"
        },
        "missing_required_infos": []
    },
    "original_transcribed_sentence": "alle otto e tredici del sedici aprile duemilaventicinque storie dicendo un verbale per il veicolo macchina agricola targato i sette centottantanove capelli con targa speciale immatricolati portogallo l'infrazione e stata accertata in via della giustizia al civico sedici con violazione del codice civile articolo trentaquattro con ma trentadue per parcheggiato in divieto di sosta sono previsti sei punti da decurtare non è stata possibile una contestazione immediata per l'assenza del trasgressori non posso applicare alcuna sanzione accessoria stampa tramite piu tutte in tedesco stampa anche la comunicazione",
    "original_sentence": "Alle 08:13 del 16/04/2025, sto redigendo un verbale per il veicolo macchina agricola targato IJ789KL con targa speciale, immatricolato in portogalloL'infrazione è stata accertata in via della Giustizia, al civico 16, con violazione del codice civile, articolo 34,comma 32 per parcheggio in divieto di sosta Sono previsti 6 punti da decurtare. Non è stata possibile una contestazione immediata per l'assenza del trasgressore. Non posso applicare alcuna sanzione accessoria. Stampa tramite bluetooth, in tedesco, stampa anche la comunicazione. "
}