{
    "scraped_data": {
        "summary": "Il documento descrive un verbale emesso il 23 aprile 2025 alle 8:08 per un'infrazione accertata in via Roma, civico 77. Il veicolo coinvolto è una macchina agricola con targa speciale immatricolata in Spagna. La violazione riguarda il codice penale, articolo 39, comma 37, per parcheggio davanti a passo carabine. Sono previsti quattro punti da decurtare. Non è stata possibile una contestazione immediata per l'assenza del trasgressore. La stampa del verbale avviene tramite Wi-Fi in lingua olandese, senza includere la comunicazione.",
        "report": {
            "verbale_preavviso": "verbale",
            "data_violazione": "ventitré aprile duemilaventicinque",
            "ora_violazione": "otto e otto minuti",
            "Strada_1": "via roma",
            "Civico_1": "settantasette",
            "lista_veicoli": [
                {
                    "tipologia": "macchina agricola",
                    "nazione": "spagna",
                    "targa": "guerra sei centocinquantaquattro e se ti",
                    "tipologia_targa": "speciale",
                    "marca_modello": null,
                    "colore": null
                }
            ],
            "contestazione_immediata": null,
            "motivo_mancata_contestazione": "assenza del trasgressori",
            "violazioni": [
                {
                    "codice": "penale",
                    "articolo": "trentanove",
                    "comma": "trentasette",
                    "sanzione_accessoria": null
                }
            ],
            "punti": "quattro, before: previsti, after: da",
            "tipo_stampa": "vuoi fai",
            "lingua_stampa": "olandese",
            "stampa_anche_comunicazione": "non stampare anche la comunicazione"
        },
        "missing_required_infos": []
    },
    "original_transcribed_sentence": "alle otto e otto minuti del ventitré aprile duemilaventicinque storie di gendo un verbale per il veicolo macchina agricola targato guerra sei centocinquantaquattro e se ti con targa speciale immatricolati in spagna l'infrazione e stata accertata in via roma al civico settantasette con violazione del codice penale articolo trentanove con ma trentasette per parcheggio davanti a passo carabine sono previsti quattro punti da decurtare non è stata possibile una contestazione immediata per l'assenza del trasgressori non posso applicare alcuna sanzione accessoria stampa tramite vuoi fai in olandese non stampare anche la comunicazione",
    "original_sentence": "Alle 08:08 del 23/04/2025, sto redigendo un verbale per il veicolo macchina agricola targato QR654ST con targa speciale, immatricolato in spagnaL'infrazione è stata accertata in via Roma, al civico 77, con violazione del codice penale, articolo 39,comma 37 per parcheggio davanti a passo carrabile Sono previsti 4 punti da decurtare. Non è stata possibile una contestazione immediata per l'assenza del trasgressore. Non posso applicare alcuna sanzione accessoria. Stampa tramite wifi, in olandese, non stampare anche la comunicazione."
}