{
    "scraped_data": {
        "summary": "Il documento descrive un verbale redatto il cinque maggio duemilaventicinque alle ore dodici cinquantuno per un veicolo BMW Serie Uno immatricolato in Spagna con targa \"guerra e quattrocentocinquanta sei e se ti\". L'infrazione è avvenuta in via della Pace al civico due, con violazione del codice civile articolo sei comma uno a uno a dodici per parcheggio in divieto di sosta. La contestazione è stata immediata da parte dell'agente Matteo Gallo, con sette punti da decurtare e nessuna sanzione accessoria. La stampa è prevista in olandese tramite WiFi, includendo anche la comunicazione.",
        "report": {
            "verbale_preavviso": "verbale",
            "data_violazione": "cinque maggio duemilaventicinque",
            "ora_violazione": "dodici cinquantuno",
            "Strada_1": "via della pace",
            "Civico_1": "due",
            "lista_veicoli": [
                {
                    "tipologia": "motoveicoli",
                    "nazione": "spagna",
                    "targa": "guerra e quattrocentocinquanta sei e se ti",
                    "tipologia_targa": "copertura",
                    "marca_modello": "bmw serie uno",
                    "colore": null
                }
            ],
            "contestazione_immediata": "contestazione immediata",
            "motivo_mancata_contestazione": null,
            "violazioni": [
                {
                    "codice": "civile",
                    "articolo": "sei",
                    "comma": "uno",
                    "sanzione_accessoria": null
                }
            ],
            "punti": "sette",
            "tipo_stampa": "wifi",
            "lingua_stampa": "olandese",
            "stampa_anche_comunicazione": "stampa anche la comunicazione"
        },
        "missing_required_infos": []
    },
    "original_transcribed_sentence": "il giorno cinque maggio duemilaventicinque alle ore dodici cinquantuno è stato redatto un verbale per il veicolo bmw serie uno motoveicoli immatricolati in spagna con targa guerra e quattrocentocinquanta sei e se ti di tipo copertura l'infrazione e avvenuta in via della pace al civico due e stata riscontrata una violazione del codice civile articolo sei comma uno a uno a dodici ovvero parcheggio in divieto di sosta il verbale è stato eseguito sul posto con contestazione immediata da parte della gente matteo gallo sono previsti sette punti da decurtare e non è stata applicata alcuna sanzione accessoria stampa in olandese tramite wifi stampa anche la comunicazione",
    "original_sentence": "Il giorno 05/05/2025, alle ore 12:51, è stato redatto un verbale per il veicolo BMW Serie 1, motoveicolo immatricolato in spagna con targa QR456ST di tipo copertura. L'infrazione è avvenuta in via della Pace, al civico 2. È stata riscontrata una violazione del codice civile, articolo 6, comma 1a(1-12) ovvero parcheggio in divieto di sostaIl verbale è stato eseguito sul posto, con contestazione immediata da parte dell'agente Matteo Gallo. Sono previsti 7 punti da decurtare, e non è stata applicata alcuna sanzione accessoria. Stampa in olandese tramite wifi, stampa anche la comunicazione. "
}