{
    "scraped_data": {
        "summary": "Il documento descrive un verbale emesso il venticinque aprile duemilaventicinque alle ore cinque e trentuno per un veicolo con targa croata, tipo speciale, in via della speranza al civico diciotto. La violazione riguarda il codice civile, articolo diciassette, comma quindici, per parcheggio davanti a passo carrabile. Non è stato possibile contestare sul posto per l'assenza del trasgressore. Sono previsti sette punti da decurtare, senza sanzioni accessorie. La stampa è in francese tramite Wi-Fi e include la comunicazione.",
        "report": {
            "verbale_preavviso": "verbale",
            "data_violazione": "venticinque aprile duemilaventicinque",
            "ora_violazione": "cinque trentuno",
            "Strada_1": "via della speranza",
            "Civico_1": "diciotto",
            "lista_veicoli": [
                {
                    "tipologia": "rimorchio",
                    "nazione": "croazia",
                    "targa": "i centoventitre cappelli",
                    "tipologia_targa": "speciale",
                    "marca_modello": null,
                    "colore": null
                }
            ],
            "contestazione_immediata": null,
            "motivo_mancata_contestazione": "assenza del trasgressori",
            "violazioni": [
                {
                    "codice": "civile",
                    "articolo": "diciassette",
                    "comma": "quindici",
                    "sanzione_accessoria": null
                }
            ],
            "punti": "sette",
            "tipo_stampa": "vuoi fai",
            "lingua_stampa": "francese",
            "stampa_anche_comunicazione": "stampa anche la comunicazione"
        },
        "missing_required_infos": []
    },
    "original_transcribed_sentence": "il giorno venticinque aprile duemilaventicinque alle ore cinque trentuno è stato ridato un verbale per il veicolo si tronchi tre rimorchio immatricolati in croazia con targa i centoventitre cappelli di tipo speciale l'infrazione avvenuta in via della speranza al civico diciotto e stata riscontrata una violazione del codice civile articolo diciassette comma quindici ovvero parcheggio davanti a passo arrabbi le non è stato possibile contestare sul posto a causa dell'assenza del trasgressori sono previsti sette punti da decurtare e non è stata applicata alcuna sanzioni accessoria stampa in francese tramite vuoi fai stampa anche la comunicazione",
    "original_sentence": "Il giorno 25/04/2025, alle ore 05:31, è stato redatto un verbale per il veicolo Citroen C3, rimorchio immatricolato in croazia con targa IJ123KL di tipo speciale. L'infrazione è avvenuta in via della Speranza, al civico 18. È stata riscontrata una violazione del codice civile, articolo 17, comma 15 ovvero parcheggio davanti a passo carrabileNon è stato possibile contestare sul posto a causa dell'assenza del trasgressore. Sono previsti 7 punti da decurtare, e non è stata applicata alcuna sanzione accessoria. Stampa in francese tramite wifi, stampa anche la comunicazione. "
}