{
    "scraped_data": {
        "summary": "Il documento riguarda la stesura di un preavviso di violazione per un veicolo ciclomotore con targa ufficiale proveniente dall'Olanda. L'infrazione è avvenuta per parcheggio in divieto di sosta il sei maggio duemilaventicinque alle ore mezzanotte e tredici in viale della scienza al numero quattordici. La violazione comporterà una decurtazione di tre punti. Si richiede la stampa in lingua portoghese con modalità hawaii e non stampare anche la comunicazione.",
        "report": {
            "verbale_preavviso": "preavviso",
            "data_violazione": "sei maggio duemilaventicinque",
            "ora_violazione": "mezzanotte tredici",
            "Strada_1": "viale della scienza",
            "Civico_1": "quattordici",
            "lista_veicoli": [
                {
                    "tipologia": "ciclomotori",
                    "nazione": "olanda",
                    "targa": "jeff centoventitre giacca",
                    "tipologia_targa": "ufficiale",
                    "marca_modello": "dacia d'aste",
                    "colore": null
                }
            ],
            "contestazione_immediata": null,
            "motivo_mancata_contestazione": null,
            "violazioni": [
                {
                    "codice": "civile",
                    "articolo": "trentuno",
                    "comma": "trenta",
                    "sanzione_accessoria": null
                }
            ],
            "punti": "tre",
            "tipo_stampa": "hawaii",
            "lingua_stampa": "portoghese",
            "stampa_anche_comunicazione": "non stampare anche la comunicazione"
        },
        "missing_required_infos": []
    },
    "original_transcribed_sentence": "si avvisa che è in corso la stesura di un preavviso di violazione per il veicolo ciclomotori con targa è jeff centoventitre giacca di tipo ufficiale marca dacia d'aste proveniente da olanda l'infrazione nello specifico parcheggio in divieto di sosta sia e verificata in data sei maggio duemilaventicinque alle ore mezzanotte tredici in viale della scienza al numero quattordici articolo trentuno duemilanovecento trentadue con ma trenta del codice civile si comunica che dalla violazione conseguirà una decurtazione di tre punti si richiede la stampa in lingua portoghese modalità hawaii fai non stampare anche la comunicazione",
    "original_sentence": "Si avvisa che è in corso la stesura di un preavviso di violazione per il veicolo ciclomotore con targa EF123GH di tipo ufficiale, marca Dacia Duster, proveniente da olanda. L'infrazione, nello specifico parcheggio in divieto di sosta, si è verificata in data 06/05/2025 alle ore 00:13 in viale della Scienza, al numero 14 (articolo 31, 2932, comma 30 del codice civile). Si comunica che dalla violazione conseguirà una decurtazione di 3 punti.Si richiede la stampa in lingua portoghese, modalità wifi, non stampare anche la comunicazione."
}