{
    "scraped_data": {
        "summary": "Il documento descrive un preavviso notificato il diciotto aprile duemilaventicinque alle ore quindici e cinquantacinque per una macchina agricola con targa speciale immatricolata in Croazia. L'infrazione è stata rilevata in corso della giustizia al civico ventitré, violando il codice civile articolo ventisette comma venticinque, per parcheggio in doppia fila. Non è stato possibile contestare immediatamente per l'assenza del trasgressore. Sono da decurtare quattro punti. Il veicolo è un Pallide Street 750 di colore giallo. La stampa del preavviso è richiesta tramite Wi-Fi in olandese, senza stampare anche la comunicazione.",
        "report": {
            "verbale_preavviso": "preavviso",
            "data_violazione": "diciotto aprile duemilaventicinque",
            "ora_violazione": "quindici e cinquantacinque",
            "Strada_1": "corso della giustizia",
            "Civico_1": "ventitré",
            "lista_veicoli": [
                {
                    "tipologia": "macchina agricola",
                    "nazione": "croazia",
                    "targa": "tu trecentoventi uno doppia bux",
                    "tipologia_targa": "speciale",
                    "marca_modello": "pallide bensí street settecentocinquanta",
                    "colore": "giallo"
                }
            ],
            "contestazione_immediata": null,
            "motivo_mancata_contestazione": "assenza del trasgressori",
            "violazioni": [
                {
                    "codice": "civile",
                    "articolo": "ventisette",
                    "comma": "venticinque",
                    "sanzione_accessoria": null
                }
            ],
            "punti": "quattro, before: decurtare, after: punti",
            "tipo_stampa": "vuoi fai",
            "lingua_stampa": "olandese",
            "stampa_anche_comunicazione": "non stampare anche la comunicazione"
        },
        "missing_required_infos": []
    },
    "original_transcribed_sentence": "in data diciotto aprile duemilaventicinque alle ore quindici e cinquantacinque è stato notificato un preavviso per un macchina agricola targa tu trecentoventi uno doppia bux con targa speciale immatricolati in croazia l'infrazione stata rilevata in corso della giustizia al civico ventitré con violazione del codice civile articolo ventisette comma venticinque in particolare se riscontrato un parcheggio in doppia fila non è stato possibile contestare per l'assenza del trasgressori da decurtare ci sono quattro punti il veicolo è un pallide bensí street settecentocinquanta di colore giallo con numero di telaio otto zero tre due quattro tre tre quattro cinque massa tremila centotrentasette chili necessita la stampa del preavviso tramite vuoi fai in olandese non stampare anche la comunicazione",
    "original_sentence": "In data 18/04/2025, alle ore 15:55, è stato notificato un preavviso per un macchina agricola targato UV321WX con targa speciale, immatricolato in croazia. L'infrazione è stata rilevata in corso della Giustizia, al civico 23, con violazione del codice civile, articolo 27, comma 25, in particolare si è riscontrato un parcheggio in doppia fila Non è stato possibile contestare per l'assenza del trasgressore. Da decurtare ci sono 4 punti. Il veicolo è un Harley-Davidson Street 750 di colore giallo, con numero di telaio 803243345 e massa 3137 kg. Necessito la stampa del preavviso tramite wifi, in olandese, non stampare anche la comunicazione. "
}