{
    "scraped_data": {
        "summary": "Il documento descrive un verbale redatto il 20 aprile 2025 alle ore 10:51 per un veicolo immatricolato in Italia con targa ufficiale. L'infrazione è avvenuta in via della Concordia, civico 14, per transito in zona accesso vietato. La violazione riguarda il codice civile, articolo 43, comma 41. La contestazione è stata immediata e sono previsti dieci punti da decurtare. La stampa è in italiano tramite Wi-Fi e include la comunicazione.",
        "report": {
            "verbale_preavviso": "verbale",
            "data_violazione": "venti aprile duemilaventicinque",
            "ora_violazione": "dieci e cinquantuno",
            "Strada_1": "via della concordia",
            "Civico_1": "quattordici",
            "lista_veicoli": [
                {
                    "tipologia": "autovettura",
                    "nazione": "italia",
                    "targa": "guerre quattrocentocinquanta sei se ti",
                    "tipologia_targa": "ufficiale",
                    "marca_modello": "mit subisci colte",
                    "colore": null
                }
            ],
            "contestazione_immediata": "contestazione immediata",
            "motivo_mancata_contestazione": null,
            "violazioni": [
                {
                    "codice": "civile",
                    "articolo": "quarantatré",
                    "comma": "quarantuno",
                    "sanzione_accessoria": null
                }
            ],
            "punti": "dieci, before: previsti, after: da",
            "tipo_stampa": "vuoi fai",
            "lingua_stampa": "italiano",
            "stampa_anche_comunicazione": "stampa anche la comunicazione"
        },
        "missing_required_infos": []
    },
    "original_transcribed_sentence": "il giorno venti aprile duemilaventicinque alle ore dieci e cinquantuno è stato redatto un verbale per il veicolo mit subisci colte autovettura immatricolati in italia con targa guerre quattrocentocinquanta sei se ti di tipo ufficiale l'infrazione e avvenuta in via della concordia al civico quattordici stata riscontrata una violazione del codice civile articolo quarantatré con ma quarantuno vero transito in zona accesso vietato verbale è stato eseguito sul posto con contestazione immediata da parte della gente chiara romano sono previsti dieci punti da decurtare e non è stata applicata alcuna sanzione accessoria stampa in italiano tramite vuoi fai stampa anche la comunicazione",
    "original_sentence": "Il giorno 20/04/2025, alle ore 10:51, è stato redatto un verbale per il veicolo Mitsubishi Colt, autovettura immatricolato in italia con targa QR456ST di tipo ufficiale.L'infrazione è avvenuta in via della Concordia, al civico 14. È stata riscontrata una violazione del codice civile, articolo 43, comma 41 ovvero transito in zona accesso vietatoIl verbale è stato eseguito sul posto, con contestazione immediata da parte dell'agente Chiara Romano. Sono previsti 10 punti da decurtare, e non è stata applicata alcuna sanzione accessoria. Stampa in italiano tramite wifi, stampa anche la comunicazione."
}