{
    "scraped_data": {
        "summary": "Il documento descrive una violazione avvenuta il cinque maggio duemilaventicinque alle ore ventidue trentatré. Un verbale è stato elevato al veicolo Dacia d'aste, una macchina operatrice con targa francese, per violazione dell'articolo sei, comma uno dodici del codice stradale, per parcheggio davanti a passo carabine. La violazione è stata rilevata in piazza Venezia al civico uno. Non è stato possibile effettuare la contestazione immediata a causa dell'assenza del trasgressore. La violazione comporta la decurtazione di otto punti. La stampa è richiesta in lingua francese via Hawaii e include anche la comunicazione.",
        "report": {
            "verbale_preavviso": "verbale",
            "data_violazione": "cinque maggio duemilaventicinque",
            "ora_violazione": "ventidue trentatré",
            "Strada_1": "piazza venezia",
            "Civico_1": "uno",
            "lista_veicoli": [
                {
                    "tipologia": "macchina operatrice",
                    "nazione": "francia",
                    "targa": "è jeff sei centocinquantaquattro giacca",
                    "tipologia_targa": "prova",
                    "marca_modello": "dacia d'aste",
                    "colore": null
                }
            ],
            "contestazione_immediata": null,
            "motivo_mancata_contestazione": "assenza del trasgressori",
            "violazioni": [
                {
                    "codice": "stradale",
                    "articolo": "sei",
                    "comma": "uno dodici",
                    "sanzione_accessoria": null
                }
            ],
            "punti": "otto, before: derivano, after: decurtazione",
            "tipo_stampa": "via hawaii",
            "lingua_stampa": "francese",
            "stampa_anche_comunicazione": "fai stampa anche la comunicazione"
        },
        "missing_required_infos": []
    },
    "original_transcribed_sentence": "in data cinque maggio duemilaventicinque alle ore ventidue trentatré si eleva verbale al veicolo dacia d'aste macchina operatrice con targa è jeff sei centocinquantaquattro giacca di tipo prova immatricolati in francia per violazione dell'articolo sei con ma prima uno dodici del codice stradale ovvero parcheggio davanti a passo carabine rilevata in piazza venezia al civico uno non è stato possibile effettuare la contestazione immediata data all'assenza del trasgressori dalla violazione derivano otto punti di decurtazione stampa necessaria in lingua francese via hawaii fai stampa anche la comunicazione",
    "original_sentence": "In data 05/05/2025, alle ore 22:33, si eleva verbale al veicolo Dacia Duster, macchina operatrice con targa EF654GH di tipo prova, immatricolato in francia, per violazione dell'articolo 6, comma 1a(1-12) del codice stradale, ovvero parcheggio davanti a passo carrabile, rilevata in piazza Venezia, al civico 1.Non è stato possibile effettuare la contestazione immediata data l'assenza del trasgressore. Dalla violazione derivano 8 punti di decurtazione. Stampa necessaria in lingua francese via wifi, stampa anche la comunicazione."
}