{
    "scraped_data": {
        "summary": "Il documento descrive una violazione avvenuta il dieci aprile duemilaventicinque alle ore sedici e diciotto. Un verbale è stato elevato per un veicolo immatricolato in Austria, di tipo ufficiale, per violazione dell'articolo trentuno duemilanovecento trentadue comma trenta del codice civile. La violazione riguarda il parcheggio davanti a passo carabine, rilevata in via del corso al civico dodici. Non è stata possibile la contestazione immediata a causa dell'assenza del trasgressore. La violazione comporta la decurtazione di quattro punti. La stampa è richiesta in lingua inglese via Bluetooth, senza stampare anche la comunicazione.",
        "report": {
            "verbale_preavviso": "verbale",
            "data_violazione": "dieci aprile duemilaventicinque",
            "ora_violazione": "sedici e diciotto",
            "Strada_1": "via del corso",
            "Civico_1": "dodici",
            "lista_veicoli": [
                {
                    "tipologia": "ciclomotori",
                    "nazione": "austria",
                    "targa": "ragazza quattrocentocinquanta sei cupi",
                    "tipologia_targa": "ufficiale",
                    "marca_modello": "un dai venti",
                    "colore": null
                }
            ],
            "contestazione_immediata": null,
            "motivo_mancata_contestazione": "assenza del trasgressori",
            "violazioni": [
                {
                    "codice": "civile",
                    "articolo": "trentuno",
                    "comma": "trenta",
                    "sanzione_accessoria": null
                }
            ],
            "punti": "quattro",
            "tipo_stampa": "blu tu",
            "lingua_stampa": "inglese",
            "stampa_anche_comunicazione": "non stampare anche la comunicazione"
        },
        "missing_required_infos": []
    },
    "original_transcribed_sentence": "in data dieci aprile duemilaventicinque alle ore sedici e diciotto si eleva verbale al veicolo un dai venti ciclomotori conta ragazza quattrocentocinquanta sei cupi di tipo ufficiale immatricolati austria per violazione dell'articolo trentuno duemilanovecento trentadue comma trenta del codice civile ovvero parcheggio davanti a passo carabine rilevata in via del corso al civico dodici non è stato possibile effettuare la contestazione immediata data all'assenza del trasgressori dalla violazione derivano quattro punti di decurtazione stampa necessaria in lingua inglese via blu tu non stampare anche la comunicazione",
    "original_sentence": "In data 10/04/2025, alle ore 16:18, si eleva verbale al veicolo Hyundai i20, ciclomotore con targa ZA456QP di tipo ufficiale, immatricolato in austria, per violazione dell'articolo 31, 2932, comma 30 del codice civile, ovvero parcheggio davanti a passo carrabile, rilevata in via del Corso, al civico 12.Non è stato possibile effettuare la contestazione immediata data l'assenza del trasgressore. Dalla violazione derivano 4 punti di decurtazione. Stampa necessaria in lingua inglese via bluetooth, non stampare anche la comunicazione."
}