{
    "scraped_data": {
        "summary": "Il documento descrive la stesura di un verbale per un'infrazione stradale. Il veicolo coinvolto è una macchina operatrice marca Mas Chips, targata NE 320, proveniente dalla Spagna. L'infrazione è stata rilevata il 6 maggio 2025 alle ore 5:40 in viale della Libertà, civico 22, per parcheggio su strisce pedonali, violando l'articolo 35, comma 33 del codice penale. L'agente Matteo Gallo ha provveduto alla contestazione immediata, comportando la perdita di 8 punti. Si richiede la stampa del verbale in portoghese tramite Bluetooth, includendo anche la comunicazione.",
        "report": {
            "verbale_preavviso": "verbale",
            "data_violazione": "sei maggio duemilaventicinque",
            "ora_violazione": "cinque i quaranta",
            "Strada_1": "viale della libertà",
            "Civico_1": "ventidue",
            "lista_veicoli": [
                {
                    "tipologia": "macchina operatrice",
                    "nazione": "spagna",
                    "targa": "ne trecentoventi",
                    "tipologia_targa": "copertura",
                    "marca_modello": "mas chips tre",
                    "colore": null
                }
            ],
            "contestazione_immediata": "contestazione immediata",
            "motivo_mancata_contestazione": null,
            "violazioni": [
                {
                    "codice": "penale",
                    "articolo": "trentacinque",
                    "comma": "trentatré",
                    "sanzione_accessoria": null
                }
            ],
            "punti": "otto, before: perdita, after: punti",
            "tipo_stampa": "brutus",
            "lingua_stampa": "portoghese",
            "stampa_anche_comunicazione": "stampa anche la comunicazione"
        },
        "missing_required_infos": []
    },
    "original_transcribed_sentence": "procedo con la stesura di un verbale per il veicolo macchina operatrice marca mas chips tre targato ne trecentoventi uno o più di tipo copertura proveniente da spagna l'infrazione e stata rilevata il sei maggio duemilaventicinque alle ore cinque i quaranta il veicolo si trovava in viale della libertà al civico ventidue in parcheggio su strisce pedonali violando l'articolo trentacinque coma trentatré del codice penale l'agente matteo gallo a provveduto alla contestazione immediata dell'infrazione la violazione comporta la perdita di otto punti richiedo la stampa del verbale in portoghese tramite brutus stampa anche la comunicazione",
    "original_sentence": "Procedo con la stesura di un verbale per il veicolo macchina operatrice, marca Mazda CX-3, targato MN321OP (di tipo copertura), proveniente da spagna. L'infrazione è stata rilevata il 06/05/2025 alle ore 05:40. Il veicolo si trovava in viale della Libertà, al civico 22, in parcheggio su strisce pedonali, violando l'articolo 35, comma 33, del codice penale. L'agente Matteo Gallo ha provveduto alla contestazione immediata dell'infrazione. La violazione comporta la perdita di 8 punti. Richiedo la stampa del verbale in portoghese tramite bluetooth, stampa anche la comunicazione. "
}