{
    "scraped_data": {
        "summary": "Il documento descrive un verbale emesso il 29 aprile 2025 alle ore 15:47 per un veicolo immatricolato in Austria con targa di tipo prova. La violazione è avvenuta in via della Speranza, civico 18, per parcheggio davanti a passo carabine, violando il codice civile, articolo 53, comma 51. La contestazione è stata immediata e non è stata applicata alcuna sanzione accessoria. Sono previsti punti da decurtare. La stampa del verbale è in italiano tramite Wi-Fi e include anche la comunicazione.",
        "report": {
            "verbale_preavviso": "verbale",
            "data_violazione": "ventinove aprile duemilaventicinque",
            "ora_violazione": "quindici quarantasette",
            "Strada_1": "via della speranza",
            "Civico_1": "diciotto",
            "lista_veicoli": [
                {
                    "tipologia": "motoveicoli",
                    "nazione": "austria",
                    "targa": "i settecento ottantanove capelli",
                    "tipologia_targa": "prova",
                    "marca_modello": "peugeot duecentotto",
                    "colore": null
                }
            ],
            "contestazione_immediata": "contestazione immediata",
            "motivo_mancata_contestazione": null,
            "violazioni": [
                {
                    "codice": "civile",
                    "articolo": "cinquantatré",
                    "comma": "cinquantuno",
                    "sanzione_accessoria": null
                }
            ],
            "punti": "un, before: previsti, after: da",
            "tipo_stampa": "guai fai",
            "lingua_stampa": "italiano",
            "stampa_anche_comunicazione": "stampa anche la comunicazione"
        },
        "missing_required_infos": []
    },
    "original_transcribed_sentence": "il giorno ventinove aprile duemilaventicinque alle ore quindici quarantasette è statore dato un verbale per il veicolo peggio duecentotto motoveicoli immatricolati in austria con targa i settecento ottantanove capelli di tipo prova l'inflazione è avvenuta in via della speranza al civico diciotto e stata riscontrata una violazione del codice civile articolo cinquantatré coma cinquantuno ovvero parcheggio davanti a passo carabine il verbale è stato eseguito sul posto con contestazione immediata da parte della gente helena fontana sono previsti un punti da decurtare e non è stata applicata alcuna sanzione accessoria stampa in italiano tramite guai fai stampa anche la comunicazione",
    "original_sentence": "Il giorno 29/04/2025, alle ore 15:47, è stato redatto un verbale per il veicolo Peugeot 208, motoveicolo immatricolato in austria con targa IJ789KL di tipo prova. L'infrazione è avvenuta in via della Speranza, al civico 18. È stata riscontrata una violazione del codice civile, articolo 53, comma 51 ovvero parcheggio davanti a passo carrabileIl verbale è stato eseguito sul posto, con contestazione immediata da parte dell'agente Elena Fontana. Sono previsti 1 punti da decurtare, e non è stata applicata alcuna sanzione accessoria. Stampa in italiano tramite wifi, stampa anche la comunicazione. "
}