{
    "scraped_data": {
        "summary": "Il documento descrive una violazione accertata il primo maggio 2025 alle ore 1:39 in via Giuseppe Mazzini, civico 24. La violazione riguarda un veicolo Fiat Tipo, macchina operatrice, con targa spagnola, per transito in zona accesso vietato. La contestazione è avvenuta immediatamente da parte dell'agente Francesco Rizzo. Sono previsti quattro punti di decurtazione. Si richiede la stampa in lingua italiana via Wi-Fi, senza stampare la comunicazione.",
        "report": {
            "verbale_preavviso": "verbale",
            "data_violazione": "primo maggio duemilaventicinque",
            "ora_violazione": "una trentanove",
            "Strada_1": "via giuseppe mazzini",
            "Civico_1": "ventiquattro",
            "lista_veicoli": [
                {
                    "tipologia": "macchina operatrice",
                    "nazione": "spagna",
                    "targa": "effe trecentoventi uno giacca",
                    "tipologia_targa": "copertura",
                    "marca_modello": "fiat tipo",
                    "colore": null
                }
            ],
            "contestazione_immediata": "contestazione e avvenuta immediatamente",
            "motivo_mancata_contestazione": null,
            "violazioni": [
                {
                    "codice": "civile",
                    "articolo": "dodici",
                    "comma": "dieci",
                    "sanzione_accessoria": null
                }
            ],
            "punti": "quattro, before: previsti, after: di",
            "tipo_stampa": "vuoi fai",
            "lingua_stampa": "italiano",
            "stampa_anche_comunicazione": "non stampare anche la comunicazione"
        },
        "missing_required_infos": []
    },
    "original_transcribed_sentence": "si stai dicendo verbale per violazione accertata il primo maggio duemilaventicinque alle ore una trentanove in via giuseppe mazzini al civico ventiquattro a carico del veicolo fiat tipo macchina operatrice con targa effe trecentoventi uno giacca di tipo copertura immatricolati in spagna la violazione contestata e transito in zona accesso vietato invase all'articolo dodici ma dieci del codice civile la contestazione e avvenuta immediatamente da parte della gente francesco rizzo sono previsti quattro punti di decurtazione si richiede la stampa in lingua italiano via vuoi fai non stampare anche la comunicazione",
    "original_sentence": "Si sta redigendo verbale per violazione accertata il 01/05/2025 alle ore 01:39 in via Giuseppe Mazzini, al civico 24, a carico del veicolo Fiat Tipo, macchina operatrice con targa EF321GH di tipo copertura, immatricolato in spagna. La violazione contestata è transito in zona accesso vietato, in base all'articolo 12, comma 10 del codice civile. La contestazione è avvenuta immediatamente da parte dell'agente Francesco Rizzo. Sono previsti 4 punti di decurtazione. Si richiede la stampa in lingua italiano via wifi, non stampare anche la comunicazione. "
}