{
    "scraped_data": {
        "summary": "Il documento descrive un verbale redatto l'undici aprile 2025 alle ore 22:47 per una violazione riscontrata su un motoveicolo marca Cava Sacchi, targato EX Ypsilon 320, proveniente dal Belgio. La violazione è avvenuta in via Roma, civico 77, per parcheggio davanti a passo carabine, violando l'articolo 7, comma 15 del codice penale. L'agente Matteo Gallo ha proceduto con contestazione immediata e si prevede la decurtazione di tre punti dalla patente. La stampa è richiesta in olandese via Bluetooth, senza stampare anche la comunicazione.",
        "report": {
            "verbale_preavviso": "verbale",
            "data_violazione": "undici aprile duemilaventicinque",
            "ora_violazione": "ventidue quarantasette",
            "Strada_1": "via roma",
            "Civico_1": "settantasette",
            "lista_veicoli": [
                {
                    "tipologia": "motoveicoli",
                    "nazione": "belgio",
                    "targa": "ex ypsilon trecentoventi",
                    "tipologia_targa": "tipo copertura",
                    "marca_modello": "cava sacchi",
                    "colore": null
                }
            ],
            "contestazione_immediata": "contestazione immediata",
            "motivo_mancata_contestazione": null,
            "violazioni": [
                {
                    "codice": "penale",
                    "articolo": "sette",
                    "comma": "quindici",
                    "sanzione_accessoria": null
                }
            ],
            "punti": "tre",
            "tipo_stampa": "via potuta",
            "lingua_stampa": "olandese",
            "stampa_anche_comunicazione": "non stampare anche la comunicazione"
        },
        "missing_required_infos": []
    },
    "original_transcribed_sentence": "verbale redatto in data undici aprile duemilaventicinque alle ore ventidue quarantasette per la violazione riscontrata al veicolo motoveicoli marca cava sacchi in in già seicentocinquanta targato ex ypsilon trecentoventi alzati tipo copertura proveniente da belgio in particolare in via roma civico settantasette è stato accertato parcheggio davanti a passo carabine in violazione dell'articolo sette con ma quindici del codice penale l'agente matteo gallo a proceduto con contestazione immediata si prevede la decurtazione di tre punti dalla patente richiedo la stampa in olandese via potuta non stampare anche la comunicazione",
    "original_sentence": "Verbale redatto in data 11/04/2025 alle ore 22:47 per la violazione riscontrata al veicolo motoveicolo, marca Kawasaki Ninja 650, targato XY321ZA (tipo copertura) proveniente da belgio. In particolare, in via Roma, civico 77, è stato accertato parcheggio davanti a passo carrabile, in violazione dell'articolo 7, comma 15 del codice penale. L'agente Matteo Gallo ha proceduto con contestazione immediata. Si prevede la decurtazione di 3 punti dalla patente. Richiedo la stampa in olandese via bluetooth, non stampare anche la comunicazione. "
}