{
    "scraped_data": {
        "summary": "Il documento notifica un preavviso di violazione emesso il dodici aprile duemilaventicinque alle ore sedici e sette minuti per un veicolo registrato in Spagna. L'infrazione è avvenuta in via Giuseppe Mazzini, numero ventiquattro, per parcheggio in doppia fila, violando l'articolo sei, comma uno, dodici del codice stradale. Non è stato possibile identificare il conducente sul posto, quindi la notifica è inviata al proprietario del veicolo. Sono previsti otto punti di decurtazione. Si richiede la stampa della notifica tramite Wi-Fi in lingua inglese, senza stampare anche la comunicazione.",
        "report": {
            "verbale_preavviso": "preavviso",
            "data_violazione": "dodici aprile duemilaventicinque",
            "ora_violazione": "sedici e sette minuti",
            "Strada_1": "via giuseppe mazzini",
            "Civico_1": "ventiquattro",
            "lista_veicoli": [
                {
                    "tipologia": "macchina operatrice",
                    "nazione": "spagna",
                    "targa": "i quattrocentocinquanta sei chi lo litri",
                    "tipologia_targa": "prova",
                    "marca_modello": "chi api canto",
                    "colore": null
                }
            ],
            "contestazione_immediata": null,
            "motivo_mancata_contestazione": "non essendo stato possibile identificare il conducente sul posto",
            "violazioni": [
                {
                    "codice": "stradale",
                    "articolo": "sei",
                    "comma": "uno",
                    "sanzione_accessoria": null
                }
            ],
            "punti": "otto, before: previsti, after: di",
            "tipo_stampa": "vuoi fai",
            "lingua_stampa": "inglese",
            "stampa_anche_comunicazione": "non stampare anche la comunicazione"
        },
        "missing_required_infos": []
    },
    "original_transcribed_sentence": "si notifica che in data dodici aprile duemilaventicinque alle ore sedici e sette minuti è stato emesso un preavviso di violazione per il veicolo macchina operatrice di marca chi api canto con targa i quattrocentocinquanta sei chi lo litri tipo prova registrato in spagna l'infrazione e avvenuta in via giuseppe mazzini al numero ventiquattro e consiste in parcheggia in doppia fila come previsto dall'articolo sei con ma prima uno dodici del codice stradale non essendo stato possibile identificare il conducente sul posto la notifica viene inviata al proprietario del veicolo sono previsti otto punti di decurtazione si prega di stampare la presente notifica tramite vuoi fai in lingua inglese non stampare anche la comunicazione",
    "original_sentence": "Si notifica che in data 12/04/2025, alle ore 16:07, è stato emesso un preavviso di violazione per il veicolo macchina operatrice di marca Kia Picanto, con targa IJ456KL (tipo prova), registrato in spagna. L'infrazione è avvenuta in via Giuseppe Mazzini, al numero 24, e consiste in parcheggio in doppia fila, come previsto dall'articolo 6, comma 1a(1-12) del codice stradale. Non essendo stato possibile identificare il conducente sul posto, la notifica viene inviata al proprietario del veicolo. Sono previsti 8 punti di decurtazione.  Si prega di stampare la presente notifica tramite wifi, in lingua inglese, non stampare anche la comunicazione."
}