{
    "scraped_data": {
        "summary": "Il documento descrive la stesura di un verbale per un'infrazione stradale. Il veicolo coinvolto è una macchina operatrice marca Ducati Monster, targata \"jeffrey centoventitre giacca\", proveniente dal Belgio. L'infrazione è stata rilevata il 16 aprile 2025 alle ore 13:30 in corso Buenos Aires, civico 98, per parcheggio su strisce pedonali, violando l'articolo 5, comma 3 del codice stradale. Non è stata possibile la contestazione immediata a causa dell'assenza del trasgressore. La violazione comporta la perdita di cinque punti. Si richiede la stampa del verbale in spagnolo tramite Bluetooth, includendo anche la comunicazione.",
        "report": {
            "verbale_preavviso": "verbale",
            "data_violazione": "sedici aprile duemilaventicinque",
            "ora_violazione": "tredici trenta",
            "Strada_1": "corso buenos aires",
            "Civico_1": "novantotto",
            "lista_veicoli": [
                {
                    "tipologia": "macchina operatrice",
                    "nazione": "belgio",
                    "targa": "jeffrey centoventitre giacca",
                    "tipologia_targa": "speciale",
                    "marca_modello": "ducati monster",
                    "colore": null
                }
            ],
            "contestazione_immediata": null,
            "motivo_mancata_contestazione": "assenza del trasgressori",
            "violazioni": [
                {
                    "codice": "stradale",
                    "articolo": "cinque",
                    "comma": "tre",
                    "sanzione_accessoria": null
                }
            ],
            "punti": "cinque",
            "tipo_stampa": "blu tutte",
            "lingua_stampa": "spagnolo",
            "stampa_anche_comunicazione": "stampa anche la comunicazione"
        },
        "missing_required_infos": []
    },
    "original_transcribed_sentence": "procedo con la stesura di un verbale per il veicolo macchina operatrice marca ducati monster targato jeffrey centoventitre giacca di tipo speciale proveniente da belgio l'infrazione e stata rilevata il sedici aprile duemilaventicinque alle ore tredici trenta il veicolo si trovava in corso buenos aires al civico novantotto in parcheggio su strisce pedonali violando l'articolo cinque comma tre del codice stradale non è stato possibile effettuare la contestazione immediata a causa dell'assenza del trasgressori la violazione comporta la perdita di cinque punti richiedo la stampa del verbale in spagnolo tramite blu tutte stampa anche la comunicazione",
    "original_sentence": "Procedo con la stesura di un verbale per il veicolo macchina operatrice, marca Ducati Monster, targato EF123GH (di tipo speciale), proveniente da belgio. L'infrazione è stata rilevata il 16/04/2025 alle ore 13:30. Il veicolo si trovava in corso Buenos Aires, al civico 98, in parcheggio su strisce pedonali, violando l'articolo 5, comma 3, del codice stradale. Non è stato possibile effettuare la contestazione immediata a causa dell'assenza del trasgressore. La violazione comporta la perdita di 5 punti. Richiedo la stampa del verbale in spagnolo tramite bluetooth, stampa anche la comunicazione. "
}