{
    "scraped_data": {
        "summary": "Il documento descrive un'infrazione avvenuta il nove aprile 2025 alle ore sei cinquantadue presso viale della scienza, civico quattordici. Il veicolo coinvolto è un rimorchio Suzuki Swift immatricolato in Olanda con targa A123CDD, di colore verde. L'infrazione riguarda il codice stradale, articolo tre, comma uno, per parcheggio davanti a passo carabine. Sono stati decurtati tre punti, senza sanzioni accessorie. La stampa deve essere effettuata tramite Wi-Fi in portoghese, senza includere la comunicazione.",
        "report": {
            "verbale_preavviso": null,
            "data_violazione": "nove aprile duemilaventicinque",
            "ora_violazione": "sei cinquantadue",
            "Strada_1": "viale della scienza",
            "Civico_1": "quattordici",
            "lista_veicoli": [
                {
                    "tipologia": null,
                    "nazione": "olanda",
                    "targa": "a centoventitre ci di di",
                    "tipologia_targa": "copertura",
                    "marca_modello": "sughi swift",
                    "colore": "verde"
                }
            ],
            "contestazione_immediata": null,
            "motivo_mancata_contestazione": null,
            "violazioni": [
                {
                    "codice": "stradale",
                    "articolo": "tre",
                    "comma": "uno",
                    "sanzione_accessoria": null
                }
            ],
            "punti": "tre",
            "tipo_stampa": "vuoi fai",
            "lingua_stampa": "portoghese",
            "stampa_anche_comunicazione": "non stampare anche la comunicazione"
        },
        "missing_required_infos": []
    },
    "original_transcribed_sentence": "il nove aprile duemilaventicinque alle ore sei cinquantadue sto mettendo una notifica di infrazione per il veicolo sughi swift rimorchio immatricolati in olanda con targa a centoventitre ci di di tipo copertura l'infrazione se verificata presso viale della scienza al civico quattordici violando il codice stradale in particolare l'articolo tre comma uno riguardante il parcheggio davanti a passo carabine devo decurtare tre punti non è necessaria alcuna sanzione accessoria il rimorchio e di colore verde con numero di telaio cinque due zero zero zero cinque nove due sei e massa tremilacinquecento settantacinque chili stampa me lo con il vuoi fai in portoghese non stampare anche la comunicazione",
    "original_sentence": "Il 09/04/2025, alle ore 06:52, sto emettendo una notifica di infrazione per il veicolo Suzuki Swift, rimorchio immatricolato in olanda con targa AB123CD di tipo copertura. L'infrazione si è verificata presso viale della Scienza, al civico 14, violando il codice stradale, in particolare l'articolo 3, comma 1 riguardante il parcheggio davanti a passo carrabile. Devo decurtare 3 punti. Non è necessaria alcuna sanzione accessoria. Il rimorchio è di colore verde, con numero di telaio 520005926 e massa 3575 kg. Stampamelo con il wifi in portoghese, non stampare anche la comunicazione. "
}