{
    "scraped_data": {
        "summary": "Il documento descrive una violazione avvenuta il ventinove aprile duemilaventicinque alle ore sette. La violazione riguarda un veicolo Honda Civic con targa immatricolata in Olanda, per parcheggio davanti a passo carrabile in via della Speranza, civico diciassette. La contestazione è stata immediata, effettuata dall'agente Anna Bianchi. La violazione comporta la decurtazione di tre punti. La stampa necessaria è in lingua italiana tramite Bluetooth, senza stampare la comunicazione.",
        "report": {
            "verbale_preavviso": "verbali",
            "data_violazione": "ventinove aprile duemilaventicinque",
            "ora_violazione": "sette",
            "Strada_1": "via della speranza",
            "Civico_1": "diciassette",
            "lista_veicoli": [
                {
                    "tipologia": "macchina agricola",
                    "nazione": "olanda",
                    "targa": "guerra novecento ottantasette a",
                    "tipologia_targa": "prova",
                    "marca_modello": "honda civic",
                    "colore": null
                }
            ],
            "contestazione_immediata": "contestazione e stata immediata",
            "motivo_mancata_contestazione": null,
            "violazioni": [
                {
                    "codice": "stradale",
                    "articolo": "quarantotto",
                    "comma": "quarantasei",
                    "sanzione_accessoria": null
                }
            ],
            "punti": "tre",
            "tipo_stampa": "via blackout",
            "lingua_stampa": "italiano",
            "stampa_anche_comunicazione": "non stampare anche la comunicazione"
        },
        "missing_required_infos": []
    },
    "original_transcribed_sentence": "in data ventinove aprile duemilaventicinque alle ore sette i seggi si leva verbali al veicolo honda civic here seicentocinquanta jerry macchina agricola con targa guerra novecento ottantasette a siti di tipo prova immatricolati in olanda per violazione dell'articolo quarantotto ma quarantasei del codice stradale ovvero parcheggio davanti a passo cary abile rilevata in via della speranza al civico diciassette la contestazione e stata immediata effettuata dalla gente anna bianchi dalla violazione derivano tre punti di decurtazione stampa necessaria in lingua italiano via blackout non stampare anche la comunicazione",
    "original_sentence": "In data 29/04/2025, alle ore 07:16, si eleva verbale al veicolo Honda CBR650R, macchina agricola con targa QR987ST di tipo prova, immatricolato in olanda, per violazione dell'articolo 48, comma 46 del codice stradale, ovvero parcheggio davanti a passo carrabile, rilevata in via della Speranza, al civico 17. La contestazione è stata immediata, effettuata dall'agente Anna Bianchi. Dalla violazione derivano 3 punti di decurtazione. Stampa necessaria in lingua italiano via bluetooth, non stampare anche la comunicazione. "
}