{
    "scraped_data": {
        "summary": "Il documento descrive l'emissione di un verbale per un veicolo Harley Davidson Street 750, macchina operatrice, con targa ufficiale immatricolata in Spagna. L'infrazione è avvenuta il 10 aprile 2025 alle 21:58 in Corso della Giustizia, civico 23, per transito in zona accesso vietato secondo l'articolo 23, comma 21 del codice penale. La contestazione immediata è stata eseguita dall'agente Silvia Neri e comporta la decurtazione di nove punti. La stampa è richiesta in francese via WiFi e include anche la comunicazione.",
        "report": {
            "verbale_preavviso": "verbale",
            "data_violazione": "dieci aprile duemilaventicinque",
            "ora_violazione": "ventuno e cinquantotto",
            "Strada_1": "corso della giustizia",
            "Civico_1": "ventitre",
            "lista_veicoli": [
                {
                    "tipologia": "macchina operatrice",
                    "nazione": "spagna",
                    "targa": "curry trecentoventi uno e se ti",
                    "tipologia_targa": "ufficiale",
                    "marca_modello": "harley davidson street settecentocinquanta",
                    "colore": null
                }
            ],
            "contestazione_immediata": "contestazione immediata eseguita",
            "motivo_mancata_contestazione": null,
            "violazioni": [
                {
                    "codice": "penale",
                    "articolo": "ventitre",
                    "comma": "ventuno",
                    "sanzione_accessoria": null
                }
            ],
            "punti": "nove, before: decurtazione, after: punti",
            "tipo_stampa": "wifi",
            "lingua_stampa": "francese",
            "stampa_anche_comunicazione": "stampa anche la comunicazione"
        },
        "missing_required_infos": []
    },
    "original_transcribed_sentence": "sto emettendo un verbale per il veicolo harley davidson street settecentocinquanta macchina operatrice targa curry trecentoventi uno e se ti di tipo ufficiale immatricolati in spagna per infrazione commessa in data dieci aprile duemilaventicinque ore ventuno e cinquantotto in corso della giustizia civico ventitre è stato rilevato transito in zona accesso vietato ai sensi dell'articolo ventitre comma ventuno del codice penale contestazione immediata eseguita dall'agente silvia neri la violazione comporta la decurtazione di nove punti richiesta stampa in francese vi hawaii fai stampa anche la comunicazione",
    "original_sentence": "Sto emettendo un verbale per il veicolo Harley-Davidson Street 750 macchina operatrice, targa QR321ST di tipo ufficiale, immatricolato in spagna, per infrazione commessa in data 10/04/2025, ore 21:58. In corso della Giustizia, civico 23, è stato rilevato transito in zona accesso vietato, ai sensi dell'articolo 23, comma 21, del codice penale.Contestazione immediata eseguita dall'agente Silvia Neri. La violazione comporta la decurtazione di 9 punti. Richiesta stampa in francese via wifi, stampa anche la comunicazione."
}