{
    "scraped_data": {
        "summary": "Il documento descrive un verbale redatto il 18 aprile 2025 alle ore 17:56 per un veicolo immatricolato in Croazia con targa speciale. L'infrazione è avvenuta in Piazza Venezia, civico 1, per violazione del codice civile, articolo 158, comma 2, riguardante il parcheggio davanti a passo carabine. La contestazione immediata non è stata possibile per l'assenza del trasgressore. Sono previsti sette punti da decurtare, senza sanzioni accessorie. La stampa è richiesta in francese tramite Bluetooth, senza comunicazione aggiuntiva.",
        "report": {
            "verbale_preavviso": "verbale",
            "data_violazione": "diciotto aprile duemilaventicinque",
            "ora_violazione": "diciassette cinquantasei",
            "Strada_1": "piazza venezia",
            "Civico_1": "uno",
            "lista_veicoli": [
                {
                    "tipologia": "molto veicolo",
                    "nazione": "croazia",
                    "targa": "jeff duecentotrentaquattro",
                    "tipologia_targa": "speciale",
                    "marca_modello": null,
                    "colore": null
                }
            ],
            "contestazione_immediata": null,
            "motivo_mancata_contestazione": "assenza del trasgressori",
            "violazioni": [
                {
                    "codice": "civile",
                    "articolo": "centocinquantotto",
                    "comma": "due",
                    "sanzione_accessoria": null
                }
            ],
            "punti": "sette, before: decurtare, after: punti",
            "tipo_stampa": "blu tutta",
            "lingua_stampa": "francese",
            "stampa_anche_comunicazione": "non stampare anche la comunicazione"
        },
        "missing_required_infos": []
    },
    "original_transcribed_sentence": "il giorno diciotto aprile duemilaventicinque alle ore diciassette cinquantasei è stato redatto un verbale per il veicolo a ma meticce sette molto veicolo immatricolati in croazia con targa jeff duecentotrentaquattro di tipo speciale l'infrazione avvenuta in piazza venezia al civico uno e stata riscontrata una violazione del codice civile articolo centocinquantotto comma due ovvero parcheggio davanti a passo carabine non è stato possibile contestare sul posto a causa dell'assenza del trasgressori sono previsti sette punti da decurtare e non è stata applicata alcuna sanzione accessoria stampa in francese tramite blu tutta non stampare anche la comunicazione",
    "original_sentence": "Il giorno 18/04/2025, alle ore 17:56, è stato redatto un verbale per il veicolo Yamaha MT-07, motoveicolo immatricolato in croazia con targa FG234LM di tipo speciale.L'infrazione è avvenuta in piazza Venezia, al civico 1. È stata riscontrata una violazione del codice civile, articolo 158, comma 2 ovvero parcheggio davanti a passo carrabileNon è stato possibile contestare sul posto a causa dell'assenza del trasgressore. Sono previsti 7 punti da decurtare, e non è stata applicata alcuna sanzione accessoria. Stampa in francese tramite bluetooth, non stampare anche la comunicazione."
}