{
    "scraped_data": {
        "summary": "Il documento descrive un verbale emesso il diciotto aprile duemilaventicinque alle ventiquattro e cinquantuno per un'infrazione accertata in via della repubblica venti e via dei fori imperiali al civico dieci. Il veicolo coinvolto è un ciclomotore con targa prova immatricolato in Spagna, targato \"effe centoventitre giacca\". La violazione riguarda il codice stradale, articolo cinque, comma tre, per parcheggio davanti a passo carabine, con due punti da decurtare. Non è stata possibile una contestazione immediata per l'assenza del trasgressore. La stampa del verbale avviene tramite Wi-Fi in olandese e include anche la comunicazione.",
        "report": {
            "verbale_preavviso": "verbale",
            "data_violazione": "diciotto aprile duemilaventicinque",
            "ora_violazione": "ventiquattro e cinquantuno",
            "Strada_1": "via della repubblica",
            "Civico_1": "dieci",
            "lista_veicoli": [
                {
                    "tipologia": "ciclomotori",
                    "nazione": "spagna",
                    "targa": "effe centoventitre giacca",
                    "tipologia_targa": "prova",
                    "marca_modello": null,
                    "colore": null
                }
            ],
            "contestazione_immediata": null,
            "motivo_mancata_contestazione": "assenza del trasgressori",
            "violazioni": [
                {
                    "codice": "stradale",
                    "articolo": "cinque",
                    "comma": "tre",
                    "sanzione_accessoria": null
                }
            ],
            "punti": "due, before: previsti, after: da",
            "tipo_stampa": "vuoi fai",
            "lingua_stampa": "olandese",
            "stampa_anche_comunicazione": "stampa anche la comunicazione"
        },
        "missing_required_infos": []
    },
    "original_transcribed_sentence": "alle ventiquattro e cinquantuno del diciotto aprile duemilaventicinque storie di gendo un verbale per il veicolo ciclomotori targato effe centoventitre giacca con targa prova immatricolati in spagna l'infrazione e stata accertata in via della repubblica venti via dei fori imperiali al civico dieci con violazione del codice stradali articolo cinque coma tre per parcheggio davanti a passo carabine sono previsti due punti da decurtare non è stata possibile una contestazione immediata per l'assenza del trasgressori non posso applicare alcuna sanzione accessoria stampa tramite vuoi fai in olandese stampa anche la comunicazione",
    "original_sentence": "Alle 00:51 del 18/04/2025, sto redigendo un verbale per il veicolo ciclomotore targato EF123GH con targa prova, immatricolato in spagnaL'infrazione è stata accertata in via della Repubblica, 20via dei Fori Imperiali, al civico 10, con violazione del codice stradale, articolo 5,comma 3 per parcheggio davanti a passo carrabile Sono previsti 2 punti da decurtare. Non è stata possibile una contestazione immediata per l'assenza del trasgressore. Non posso applicare alcuna sanzione accessoria. Stampa tramite wifi, in olandese, stampa anche la comunicazione. "
}