{
    "scraped_data": {
        "summary": "Il documento descrive la stesura di un preavviso di violazione per un veicolo, una macchina agricola con targa di prova proveniente dalla Croazia. L'infrazione riguarda il parcheggio davanti a un passo carraio, avvenuta il 26 aprile 2025 alle 13:30 in via della Speranza, numero 17. La violazione è in base all'articolo 31, comma 30 del codice penale, e comporta una decurtazione di sette punti. Si richiede la stampa in lingua inglese, modalità Bluetooth, e di stampare anche la comunicazione.",
        "report": {
            "verbale_preavviso": "preavviso",
            "data_violazione": "ventisei aprile duemilaventicinque",
            "ora_violazione": "tredici e trenta",
            "Strada_1": "via della speranza",
            "Civico_1": "diciassette",
            "lista_veicoli": [
                {
                    "tipologia": "macchina agricola",
                    "nazione": "croazia",
                    "targa": "i sette centottantanove chi lo litri",
                    "tipologia_targa": "prova",
                    "marca_modello": "suzuki",
                    "colore": null
                }
            ],
            "contestazione_immediata": null,
            "motivo_mancata_contestazione": null,
            "violazioni": [
                {
                    "codice": "penale",
                    "articolo": "trentuno",
                    "comma": "trenta",
                    "sanzione_accessoria": null
                }
            ],
            "punti": "sette",
            "tipo_stampa": "blu",
            "lingua_stampa": "inglese",
            "stampa_anche_comunicazione": "stampa anche la comunicazione"
        },
        "missing_required_infos": []
    },
    "original_transcribed_sentence": "si avvisa che è in corso la stesura di un preavviso di violazione per il veicolo macchina agricola con targa i sette centottantanove chi lo litri di tipo prova marca suzuki invitare proveniente da croazia l'infrazione nello specifico parcheggio davanti a passo carabine sia e verificata in data ventisei aprile duemilaventicinque alle ore tredici e trenta in via della speranza al numero diciassette articolo trentuno duemilanovecento trentadue comma trenta del codice penale si comunica che dalla violazione conseguirà una decurtazione di sette punti si richiede la stampa in lingua inglese modalità blu stampa anche la comunicazione",
    "original_sentence": "Si avvisa che è in corso la stesura di un preavviso di violazione per il veicolo macchina agricola con targa IJ789KL di tipo prova, marca Suzuki Vitara, proveniente da croazia. L'infrazione, nello specifico parcheggio davanti a passo carrabile, si è verificata in data 26/04/2025 alle ore 13:30 in via della Speranza, al numero 17 (articolo 31, 2932, comma 30 del codice penale). Si comunica che dalla violazione conseguirà una decurtazione di 7 punti.Si richiede la stampa in lingua inglese, modalità bluetooth, stampa anche la comunicazione."
}