{
    "scraped_data": {
        "summary": "Il documento descrive una violazione avvenuta l'otto aprile 2025 alle ore 12:53. È stato elevato un verbale al veicolo con targa \"ubi trecentoventi uno doppia ex\", immatricolato in Olanda, per transito in zona vietata. La violazione è stata rilevata in via della Speranza, civico 17, e la contestazione è stata immediata. La violazione comporta la decurtazione di tre punti. La stampa del verbale è richiesta in lingua portoghese tramite Bluetooth, e include anche la comunicazione.",
        "report": {
            "verbale_preavviso": "verbale",
            "data_violazione": "otto aprile duemilaventicinque",
            "ora_violazione": "mezzogiorno e cinquantatré",
            "Strada_1": "via della speranza",
            "Civico_1": "diciassette",
            "lista_veicoli": [
                {
                    "tipologia": "molto veicolo",
                    "nazione": "olanda",
                    "targa": "ubi trecentoventi uno doppia ex",
                    "tipologia_targa": "copertura",
                    "marca_modello": null,
                    "colore": null
                }
            ],
            "contestazione_immediata": "contestazione stata immediata",
            "motivo_mancata_contestazione": null,
            "violazioni": [
                {
                    "codice": "penale",
                    "articolo": "duemiladue centotrentacinque",
                    "comma": "ventitré",
                    "sanzione_accessoria": null
                }
            ],
            "punti": "tre, before: derivano, after: decurtazione",
            "tipo_stampa": "via hawaii",
            "lingua_stampa": "portoghese",
            "stampa_anche_comunicazione": "fai stampa anche la comunicazione"
        },
        "missing_required_infos": []
    },
    "original_transcribed_sentence": "in data otto aprile duemilaventicinque alle ore mezzogiorno e cinquantatré si eleva verbale al veicolo se akhtar ho una molto veicolo con targa ubi trecentoventi uno doppia ex di tipo copertura immatricolati in olanda per violazione dell'articolo duemiladue centotrentacinque con ma ventitré del codice penale ovvero transito in zona accesso vietato rilevata in via della speranza al civico diciassette la contestazione stata immediata effettuata dalla gente sarà bellini dalla violazione derivano tre punti di decurtazione stampa necessaria in lingua portoghese via hawaii fai stampa anche la comunicazione",
    "original_sentence": "In data 08/04/2025, alle ore 12:53, si eleva verbale al veicolo Seat Arona, motoveicolo con targa UV321WX di tipo copertura, immatricolato in olanda, per violazione dell'articolo 2235, comma 23 del codice penale, ovvero transito in zona accesso vietato, rilevata in via della Speranza, al civico 17.La contestazione è stata immediata, effettuata dall'agente Sara Bellini. Dalla violazione derivano 3 punti di decurtazione. Stampa necessaria in lingua portoghese via wifi, stampa anche la comunicazione."
}