{
    "scraped_data": {
        "summary": "Il documento descrive un verbale per una violazione accertata il 3 aprile 2025 alle ore 21:42 presso i giardini al civico, riguardante un veicolo agricolo con targa speciale immatricolato in Francia. La violazione contestata è il parcheggio in divieto di sosta secondo l'articolo 7, comma 15 del codice civile. La contestazione è stata immediata da parte dell'agente Alessandro Moretti, con una decurtazione di 10 punti. Si richiede la stampa in lingua italiana via Bluetooth, includendo anche la comunicazione.",
        "report": {
            "verbale_preavviso": "verbale",
            "data_violazione": "03/04/2025",
            "ora_violazione": "21:42",
            "data_verbalizzazione": "03/04/2025",
            "ora_verbalizzazione": "21:42",
            "luogo_verbalizzazione": "giardini al civico",
            "Strada_1": "giardini",
            "Civico_1": "civico",
            "lista_veicoli": [
                {
                    "tipologia": "macchina agricola",
                    "nazione": "francia",
                    "targa": "I789",
                    "tipologia_targa": "speciale",
                    "marca_modello": null,
                    "colore": null,
                    "telaio": null,
                    "massa": null,
                    "note_veicolo": null
                }
            ],
            "contestazione_immediata": "contestazione immediata",
            "motivo_mancata_contestazione": null,
            "violazioni": [
                {
                    "codice": "civile",
                    "articolo": "7",
                    "comma": "15",
                    "sanzione_accessoria": null
                }
            ],
            "punti": 10,
            "dichiarazioni": null,
            "tipo_stampa": "bluetooth",
            "lingua_stampa": "italiano",
            "stampa_anche_comunicazione": "stampa anche la comunicazione"
        },
        "missing_required_infos": []
    },
    "original_transcribed_sentence": "si stare di gendo verbale per violazione accertata il tre aprile duemilaventicinque alle ore ventuno e quarantadue inviare dei giardini al civico tutto a carico del veicolo folk ex vaga in golf macchina agricola con targa i sette centottantanove chi lo litri di tipo speciale immatricolati in francia la violazione contestata e parcheggiato in divieto di sosta in base all'articolo sette comma quindici del codice civile la contestazione e avvenuta immediatamente da parte della gente alessandro moretti sono previsti dieci punti di decurtazione si richiede la stampa in lingua italiano via blu tutta stampa anche la comunicazione",
    "original_sentence": "Si sta redigendo verbale per violazione accertata il 03/04/2025 alle ore 21:42 in viale dei Giardini, al civico 8, a carico del veicolo Volkswagen Golf, macchina agricola con targa IJ789KL di tipo speciale, immatricolato in francia. La violazione contestata è parcheggio in divieto di sosta, in base all'articolo 7, comma 15 del codice civile.La contestazione è avvenuta immediatamente da parte dell'agente Alessandro Moretti. Sono previsti 10 punti di decurtazione. Si richiede la stampa in lingua italiano via bluetooth, stampa anche la comunicazione."
}