{
    "scraped_data": {
        "summary": "Il documento descrive un avviso di violazione per un veicolo rimorchio con targa copertura registrato in Svizzera. L'infrazione è avvenuta il 17 aprile 2025 alle 17:44 in via del Corso, civico 12, per parcheggio davanti a passo carabine, violando l'articolo 5, comma 3 del codice penale. La violazione comporta una decurtazione di 7 punti. La stampa dell'avviso è richiesta via Bluetooth in italiano, senza stampare anche la comunicazione.",
        "report": {
            "verbale_preavviso": "preavviso",
            "data_violazione": "17/04/2025",
            "ora_violazione": "17:44",
            "data_verbalizzazione": null,
            "ora_verbalizzazione": null,
            "luogo_verbalizzazione": null,
            "Strada_1": "via del corso",
            "Civico_1": "12",
            "lista_veicoli": [
                {
                    "tipologia": "rimorchio",
                    "nazione": "svizzera",
                    "targa": "io e quattrocentocinquanta sei chi lo litri",
                    "tipologia_targa": "copertura",
                    "marca_modello": null,
                    "colore": null,
                    "telaio": null,
                    "massa": null,
                    "note_veicolo": null
                }
            ],
            "contestazione_immediata": "mancata contestazione",
            "motivo_mancata_contestazione": null,
            "violazioni": [
                {
                    "codice": "penale",
                    "articolo": "5",
                    "comma": "3",
                    "sanzione_accessoria": null
                }
            ],
            "punti": 7,
            "dichiarazioni": null,
            "tipo_stampa": "bluetooth",
            "lingua_stampa": "italiano",
            "stampa_anche_comunicazione": "non stampare anche la comunicazione"
        },
        "missing_required_infos": []
    },
    "original_transcribed_sentence": "e metto un avviso di violazione quindi si tratta di un preavviso per il veicolo per corsa rimorchio targato io e quattrocentocinquanta sei chi lo litri con targa copertura registrato in svizzera per un fatto accaduto il diciassette aprile duemilaventicinque alle diciassette quarantaquattro il veicolo si trovava in via del corso al civico dodici dove è stato riscontrato parcheggio davanti a passo carabine in base all'articolo cinque con tre del codice penale questa infrazione comporta una decurtazione di sette punti genere alla stampa dell'avviso via blu tutti in italiano non stampare anche la comunicazione",
    "original_sentence": "Emetto un avviso di violazione, quindi si tratta di un preavviso, per il veicolo Opel Corsa, rimorchio, targato IJ456KL con targa copertura, registrato in svizzera,  per un fatto accaduto il 17/04/2025 alle 17:44. Il veicolo si trovava in via del Corso, al civico 12, dove è stato riscontrato parcheggio davanti a passo carrabile, in base all'articolo 5, comma 3, del codice penale. Questa infrazione comporta una decurtazione di 7 punti.  Genera la stampa dell'avviso via bluetooth in italiano, non stampare anche la comunicazione."
}