{
    "scraped_data": {
        "summary": "Il documento descrive una notifica di infrazione per un veicolo Seat Ibiza, macchina operatrice, immatricolato in Slovenia con targa ufficiale. L'infrazione è avvenuta il 13 aprile 2025 alle 4:43 in via Giuseppe Mazzini, civico 24, violando il codice penale, articolo 14, comma 1, riguardante il transito in zona accesso vietato. È prevista la decurtazione di un punto e l'applicazione di una sanzione accessoria. La stampa deve essere effettuata tramite Wi-Fi in italiano, senza includere la comunicazione.",
        "report": {
            "verbale_preavviso": "preavviso",
            "data_violazione": "13/04/2025",
            "ora_violazione": "04:43",
            "data_verbalizzazione": null,
            "ora_verbalizzazione": null,
            "luogo_verbalizzazione": null,
            "Strada_1": "via Giuseppe Mazzini",
            "Civico_1": "24",
            "lista_veicoli": [
                {
                    "tipologia": "macchina operatrice",
                    "nazione": "slovenia",
                    "targa": "ubi novecentottanta sette doppia ex",
                    "tipologia_targa": "ufficiale",
                    "marca_modello": "seat ibiza",
                    "colore": null,
                    "telaio": null,
                    "massa": null,
                    "note_veicolo": null
                }
            ],
            "contestazione_immediata": "mancata contestazione",
            "motivo_mancata_contestazione": null,
            "violazioni": [
                {
                    "codice": "penale",
                    "articolo": "14",
                    "comma": "1",
                    "sanzione_accessoria": "con sanzione accessoria"
                }
            ],
            "punti": 1,
            "dichiarazioni": null,
            "tipo_stampa": "wifi",
            "lingua_stampa": "italiano",
            "stampa_anche_comunicazione": "non stampare anche la comunicazione"
        },
        "missing_required_infos": []
    },
    "original_transcribed_sentence": "il tredici aprile duemilaventicinque alle ore quattro e quarantatré sto mettendo una notifica di infrazione per il veicolo seat ibiza macchina operatrice immatricolati slovenia con targa ubi novecentottanta sette doppia ex di tipo ufficiale l'infrazione si e verificata presso via giuseppe mazzini al civico ventiquattro violando il codice penale in particolare l'articolo quattordici con ma uno riguardante il transito in zona accesso vietato devo decurtare uno punti applico una sanzione accessoria in base alle circostanze non sono necessarie ulteriori dettagli sul macchina operatrice stampa me lo con il vuoi fa in italiano non stampare anche la comunicazione",
    "original_sentence": "Il 13/04/2025, alle ore 04:43, sto emettendo una notifica di infrazione per il veicolo Seat Ibiza, macchina operatrice immatricolato in slovenia con targa UV987WX di tipo ufficiale. L'infrazione si è verificata presso via Giuseppe Mazzini, al civico 24, violando il codice penale, in particolare l'articolo 14, comma 1 riguardante il transito in zona accesso vietato.Devo decurtare 1 punti. Applico una sanzione accessoria in base alle circostanze. Non sono necessari ulteriori dettagli sul macchina operatrice. Stampamelo con il wifi in italiano, non stampare anche la comunicazione."
}